20	https://listserv.brown.edu/archives/cgi-bin/wa?A1=ind1601c&L=conlang	lines lt log gt unmask re language common honey collaborative conlang messages 3 card exchange back 367 m lp 2016
19	https://listserv.brown.edu/archives/cgi-bin/wa?A1=ind1601b&L=conlang	lines lt unmask log gt re language word honour great artist common honey collaborative families homophones how many classes noun
19	https://listserv.brown.edu/archives/cgi-bin/wa?A1=ind1601a&L=conlang	lt gt lines log unmask re common collaborative honey language word noun proven conlang aas order real j question messages
19	https://listserv.brown.edu/archives/cgi-bin/wa?A1=ind1512e&L=conlang	lines lt log gt unmask re lexember common honey collaborative language conlang fw phonetic henry phonotactic inventory word musical jon
20	https://listserv.brown.edu/archives/cgi-bin/wa?A1=ind1512d&L=conlang	lines lt unmask log gt re lexember collaborative language common honey messages henry jim jon michael swift conlang herman miller
20	https://listserv.brown.edu/archives/cgi-bin/wa?A1=ind1512c&L=conlang	lines lt log gt unmask re lexember language common collaborative honey art henry 2015 shanoxilt cizypij jim messages fiction empires
20	https://listserv.brown.edu/archives/cgi-bin/wa?A1=ind1512b&L=conlang	lines lt unmask log gt re language lexember henry jim honey common first vocabulary grammar collaborative design ideal conlang messages
20	https://listserv.brown.edu/archives/cgi-bin/wa?A1=ind1512a&L=conlang	lines lt log gt unmask re lexember language common honey collaborative henry jim font 47 messages written 38 swanson daniel
19	https://listserv.brown.edu/archives/cgi-bin/wa?A1=ind1511e&L=conlang	lines lt log gt unmask language re honey collaborative common conlang tpi question unlws u2d new haoty glossing type messages
20	https://listserv.brown.edu/archives/cgi-bin/wa?A1=ind1511d&L=conlang	lines lt log unmask gt re word comparison known generators names writing without schematic yap backgrounds meanings model weighted random
20	https://listserv.brown.edu/archives/cgi-bin/wa?A1=ind1511c&L=conlang	re lines log lt gt unmask word comparison known generators model weighted random generation ot english why mcwhorter conlang names
20	https://listserv.brown.edu/archives/cgi-bin/wa?A1=ind1511b&L=conlang	lines lt unmask log gt re word building three way definiteness david distinction transitioning egocentric geocentric coordinate errors systems kearsley
18	https://listserv.brown.edu/archives/cgi-bin/wa?A1=ind1511a&L=conlang	lines lt log gt unmask re david musical languages more ot missing latin unicode messages help fink everson michael alex
18	https://listserv.brown.edu/archives/cgi-bin/wa?A1=ind1510e&L=conlang	lines lt log gt unmask re question syntax how many parts loglang does speech need looking thread conlang 1998 messages
18	https://listserv.brown.edu/archives/cgi-bin/wa?A1=ind1510d&L=conlang	lines lt unmask log gt re theory conlanging advice syntax question brown how does loglang speech parts many need conlang
20	https://listserv.brown.edu/archives/cgi-bin/wa?A1=ind1510c&L=conlang	lines lt log gt unmask re loglangs logic purpose formal conlang expulsion gleki l brown arxokuna r j principles ials
20	https://listserv.brown.edu/archives/cgi-bin/wa?A1=ind1510b&L=conlang	lines lt log gt unmask re ot missing latin unicode aas simpler paas j con grammatical terminology conlang rosta messages
19	https://listserv.brown.edu/archives/cgi-bin/wa?A1=ind1510a&L=conlang	lines lt log gt unmask re aas simpler paas language lurk loglan perfect lojban conlangs brown misuse rosta messages r
20	https://listserv.brown.edu/archives/cgi-bin/wa?A1=ind1509d&L=conlang	lines lt log gt unmask re breakthrough celimine diachronics simpler aas paas database valency patterns peterson david rosta messages kearsley
20	https://listserv.brown.edu/archives/cgi-bin/wa?A1=ind1509c&L=conlang	lines lt log gt unmask re colors h difficult day jarda messages ot conlang jul23 c6 dlm dependency length minimization
20	https://listserv.brown.edu/archives/cgi-bin/wa?A1=ind1509b&L=conlang	lt gt lines log unmask re pronouns other messages ot genderizing sister wsl kearsley resultative logan prepositions mapping form x15
20	https://listserv.brown.edu/archives/cgi-bin/wa?A1=ind1509a&L=conlang	lines lt unmask log gt re roger mills pronouns ot university mandated standard non tennessee knoxville tell j yourself conjunctional
20	https://listserv.brown.edu/archives/cgi-bin/wa?A1=ind1508e&L=conlang	lines lt log gt unmask re problem posed non standard tennessee university mandated pronouns ot knoxville conjunctional boring languages conlang
20	https://listserv.brown.edu/archives/cgi-bin/wa?A1=ind1508c&L=conlang	lines lt log gt unmask re babel text chat different eth frix ergativity split leave messages thomas james ruhm mairese
20	https://listserv.brown.edu/archives/cgi-bin/wa?A1=ind1508b&L=conlang	lines lt unmask log gt re alien language research dlm dependency length minimization english simpler phonology hodor rosta messages glottal
20	https://listserv.brown.edu/archives/cgi-bin/wa?A1=ind1508a&L=conlang	lines lt unmask log gt re phonology glottal stop german j jason cullen mark reed english astronautical klingon pidgin brown
20	https://listserv.brown.edu/archives/cgi-bin/wa?A1=ind1507e&L=conlang	lines lt log gt unmask re phonology much conlang britainese problem how script too brown ra r romlang morphology revived
20	https://listserv.brown.edu/archives/cgi-bin/wa?A1=ind1507d&L=conlang	lt gt lines unmask log re translating welcome alien language research j conlang fasim 311 u 257 hello reed mark
20	https://listserv.brown.edu/archives/cgi-bin/wa?A1=ind1507c&L=conlang	lines lt unmask log gt re statistical naturalism alphabets language newbie hello question noun clauses alien research messages david want
20	https://listserv.brown.edu/archives/cgi-bin/wa?A1=ind1507b&L=conlang	lines lt log gt unmask re language david alien research prog n aacute featuring ithkuil sung rock kaduat peterson conlang
19	https://listserv.brown.edu/archives/cgi-bin/wa?A1=ind1507a&L=conlang	lines lt log gt unmask naturalism statistical re alphabets euml conlang new song dz baj afirhin scaron larha tuun translation
19	https://listserv.brown.edu/archives/cgi-bin/wa?A1=ind1506e&L=conlang	conlang software solution wordlist keeping lines unmask gt log lt re 5 author contents table l mailing list hide faq
20	https://listserv.brown.edu/archives/cgi-bin/wa?A1=ind1506c&L=conlang	lines lt unmask gt log re logograms naturalistic grammars ah forget term cognitive frameworks conlang brown rosta fictional messages vs
20	https://listserv.brown.edu/archives/cgi-bin/wa?A1=ind1506b&L=conlang	re lines lt unmask log gt naturalistic grammars david peterson brown j fictional rosta vs sugar human syntactic languages kearsley
19	https://listserv.brown.edu/archives/cgi-bin/wa?A1=ind1506a&L=conlang	lines lt log gt unmask re naturalistic grammars your listserv welcome j brown conlang mark reed jeffrey bogolangs again semantic
18	https://listserv.brown.edu/archives/cgi-bin/wa?A1=ind1505e&L=conlang	lines lt unmask log gt re dealing semantic drift your diachronics conlang brown unlws wordlist keeping r bpj solution software
19	https://listserv.brown.edu/archives/cgi-bin/wa?A1=ind1505d&L=conlang	lines lt log gt unmask re software solution keeping wordlist poetic vs tir relay written euml miller herman spoken conlang
20	https://listserv.brown.edu/archives/cgi-bin/wa?A1=ind1505b&L=conlang	lines lt log gt unmask re conlang loves languages messages translation tir stem verbs euml 2 consonant lat development muai
19	https://listserv.brown.edu/archives/cgi-bin/wa?A1=ind1505a&L=conlang	lines log unmask lt gt re conlang chinese myths amateurish auxlangs messages loves muai development invented languages tense new aspect
20	https://listserv.brown.edu/archives/cgi-bin/wa?A1=ind1504e&L=conlang	lines lt unmask log gt conlang oneself re border language artificial patrol 5 author contents table ot l exam sai
20	https://listserv.brown.edu/archives/cgi-bin/wa?A1=ind1504d&L=conlang	lines lt log gt unmask re oneself thoughts current sohlob adam walker worst poetry cases messages determiners relativistic language tenses
20	https://listserv.brown.edu/archives/cgi-bin/wa?A1=ind1504c&L=conlang	lines lt log gt unmask re poetry worst language mdash etymological registers star musical daniel messages bowman morphemeaddict q predicate
17	https://listserv.brown.edu/archives/cgi-bin/wa?A1=ind1504b&L=conlang	lines lt log gt unmask re adjectives within noun order phrase conlang data frequency phonemic your 12540 analysis worlds karen
18	https://listserv.brown.edu/archives/cgi-bin/wa?A1=ind1504a&L=conlang	lines lt log gt unmask re conlang your data frequency phonemic analysis changes hanzi writing lojban system special word part
20	https://listserv.brown.edu/archives/cgi-bin/wa?A1=ind1503e&L=conlang	lines lt log gt unmask conlang card exchange re nearly vocative phonology complete 5 author yet grammatical messages contents table
19	https://listserv.brown.edu/archives/cgi-bin/wa?A1=ind1503c&L=conlang	lines lt unmask log gt re call case inflection wtf messages more 3 aspect indicated alignment only ergative lang split
20	https://listserv.brown.edu/archives/cgi-bin/wa?A1=ind1503b&L=conlang	lines lt log gt unmask re better herman miller rhyme jarda conlang 3 14 15 messages adventures collaborative 2 52
20	https://listserv.brown.edu/archives/cgi-bin/wa?A1=ind1503a&L=conlang	gt lines lt unmask log re collaborative adventures conlanging 3d hard feature conlang march 2015 messages translation challenge believe don
20	https://listserv.brown.edu/archives/cgi-bin/wa?A1=ind1502d&L=conlang	lines log unmask lt gt re suprasegmental letters evidential verbruary conlang adam walker herman miller non translating langs messages 3d
19	https://listserv.brown.edu/archives/cgi-bin/wa?A1=ind1502c&L=conlang	lines lt log gt unmask re verbruary tense marked word verb order herman miller adam walker conlang messages polysemy index
19	https://listserv.brown.edu/archives/cgi-bin/wa?A1=ind1502b&L=conlang	lines lt log gt unmask re verbruary challenging clause design choices polysemy anyone project d ph good miller herman need
19	https://listserv.brown.edu/archives/cgi-bin/wa?A1=ind1502a&L=conlang	lines lt log gt unmask re how money verbruary language j reversed polarity design choices more visual jones alien messages
20	https://listserv.brown.edu/archives/cgi-bin/wa?A1=ind1501e&L=conlang	lines lt unmask log gt re phonology sign languages conlang script martian relay 7 messages numbers 3 polar author table
20	https://listserv.brown.edu/archives/cgi-bin/wa?A1=ind1501d&L=conlang	lines lt log gt unmask re babylonian songs pocket literature phonology sign languages garberson julian conlang messages relay script 4
20	https://listserv.brown.edu/archives/cgi-bin/wa?A1=ind1501c&L=conlang	lines lt log gt unmask re date lcc 6 english conlang conlangs use 349 audio only messages language yardish modern
20	https://listserv.brown.edu/archives/cgi-bin/wa?A1=ind1501b&L=conlang	lines lt log gt unmask re homophones messages martian google basic conlang system information fun miles anthony polar personal translate
20	https://listserv.brown.edu/archives/cgi-bin/wa?A1=ind1501a&L=conlang	lines lt unmask log gt re auxlang publication study complexity realism translation exact conlang avoiding equivalents messages ministry tongues brown
20	https://listserv.brown.edu/archives/cgi-bin/wa?A1=ind1412d&L=conlang	lines lt log gt unmask re lexember languages idea naming instantaneous lasting long terminology verbs conlang miller herman debatable contribution
20	https://listserv.brown.edu/archives/cgi-bin/wa?A1=ind1412c&L=conlang	lines lt unmask log gt re lexember adventures wonderland international alphabet phonetic published alice evertype conlang words messages j kollerdouglas
19	https://listserv.brown.edu/archives/cgi-bin/wa?A1=ind1412b&L=conlang	lines lt unmask log gt re lexember words spatialization mixing work unused natlang putting j lojban exchanges messages script relay
19	https://listserv.brown.edu/archives/cgi-bin/wa?A1=ind1412a&L=conlang	lines lt unmask log gt re lexember logic case introduction new lojban exchanges ariabu messages process j brown ccial grandsire
19	https://listserv.brown.edu/archives/cgi-bin/wa?A1=ind1411e&L=conlang	lines lt unmask log gt re ariabu new process conlang mythical lexember paradichlorobenzene creatures messages morphemeaddict author table contents bleackley
19	https://listserv.brown.edu/archives/cgi-bin/wa?A1=ind1411d&L=conlang	conlang re lines lt log gt unmask list terms again yaept ot bogolang name better brown r rhiemeier rg ouml
20	https://listserv.brown.edu/archives/cgi-bin/wa?A1=ind1411c&L=conlang	lines lt unmask log gt re day lexember script relay let try again mutual glottochronology intelligibility miller herman list treacle
20	https://listserv.brown.edu/archives/cgi-bin/wa?A1=ind1411b&L=conlang	log unmask lines lt gt re list resources conlanging day language engelang article draft illogical conlang question regarding terms sex
20	https://listserv.brown.edu/archives/cgi-bin/wa?A1=ind1411a&L=conlang	lines log unmask lt gt re article engelang draft day conlang course messages conjugating adverbs brown let relay austin patrik
20	https://listserv.brown.edu/archives/cgi-bin/wa?A1=ind1410e&L=conlang	lines lt unmask log gt difference between lojban ithkuil day conlang re author table contents asking comparison 8 herman miller
20	https://listserv.brown.edu/archives/cgi-bin/wa?A1=ind1410d&L=conlang	lines lt log gt unmask day re 20 30 project language messages gary shannon herman miller 4 2 windy 5
19	https://listserv.brown.edu/archives/cgi-bin/wa?A1=ind1410c&L=conlang	lines lt log gt unmask re project tense vs aspect new vive diff la chinese rence myths brown list myriad
19	https://listserv.brown.edu/archives/cgi-bin/wa?A1=ind1410b&L=conlang	lines lt unmask log gt re tense present new conlang vs aspect project gary shannon again brown oh messages 3
20	https://listserv.brown.edu/archives/cgi-bin/wa?A1=ind1410a&L=conlang	lines lt log gt unmask re conlang any good mathematical formula spoken messages evolving oh again systems 4 grapheion symbols
19	https://listserv.brown.edu/archives/cgi-bin/wa?A1=ind1409e&L=conlang	lines lt unmask log gt conlang re writing system use should oriono walen vae 5 author contents moser ruhm thomas
18	https://listserv.brown.edu/archives/cgi-bin/wa?A1=ind1409d&L=conlang	lines lt unmask log gt order chaos re conlang 2014 should system writing use gary shannon author role award smiley
20	https://listserv.brown.edu/archives/cgi-bin/wa?A1=ind1409c&L=conlang	lines lt unmask log gt re script relay idea structure languages sentence terminology messages alien 2014 sound couple visual conlang
20	https://listserv.brown.edu/archives/cgi-bin/wa?A1=ind1409b&L=conlang	lines lt unmask log gt re alien sexology native altlangs american languages recognizing without really castro leonardo learning theory them
19	https://listserv.brown.edu/archives/cgi-bin/wa?A1=ind1408d&L=conlang	lines lt unmask log gt re language conlang oral germanic back remember years non linear help messages dutch software recommendations
19	https://listserv.brown.edu/archives/cgi-bin/wa?A1=ind1408c&L=conlang	lines lt log gt unmask re big versus large conlang tv ad conlanging academic annoyances semantics ot leo moser messages
19	https://listserv.brown.edu/archives/cgi-bin/wa?A1=ind1408b&L=conlang	lines lt log gt unmask re big versus large language participants request study messages arts analogy conlanging visual conlang balancing
19	https://listserv.brown.edu/archives/cgi-bin/wa?A1=ind1408a&L=conlang	re lines lt gt unmask log language universal communicating space participate gothic site aliens minimalist grammar new thomas ruhm verb
20	https://listserv.brown.edu/archives/cgi-bin/wa?A1=ind1407e&L=conlang	re universal language communicating space gt unmask log lt lines aliens minimalist grammar conlang rosta patrik austin entire song into
20	https://listserv.brown.edu/archives/cgi-bin/wa?A1=ind1407d&L=conlang	lines lt log gt unmask re language universal communicating space aliens syntax logan kearsley languages austin patrik unusual much smith
20	https://listserv.brown.edu/archives/cgi-bin/wa?A1=ind1407c&L=conlang	lines lt unmask log gt re language space communicating universal aliens question jul13 ot jones theory writing single list smith
20	https://listserv.brown.edu/archives/cgi-bin/wa?A1=ind1407b&L=conlang	lines lt log gt unmask re writing ladino reccreation single conlang theory origin r first fwd daniel messages ulo scaron
20	https://listserv.brown.edu/archives/cgi-bin/wa?A1=ind1407a&L=conlang	lines lt unmask log gt re r culture plain hiding sight conlang conditions coronal contrastive become guttural under subtractive morphology
20	https://listserv.brown.edu/archives/cgi-bin/wa?A1=ind1406e&L=conlang	conlang lines lt unmask log gt questions shorthand author table answering relay 3 singing semitic contents polar fwd review invading
20	https://listserv.brown.edu/archives/cgi-bin/wa?A1=ind1406d&L=conlang	lines lt log gt unmask re limits dialectal variation shorthand daniel jeff rollin jones gregg questions messages brown typology again
20	https://listserv.brown.edu/archives/cgi-bin/wa?A1=ind1406c&L=conlang	lines lt log gt unmask re futhark hypothetical evolution english siva kalyan languages mix french thomas ruhm u bpj codeswitchlang
19	https://listserv.brown.edu/archives/cgi-bin/wa?A1=ind1406b&L=conlang	lines lt unmask log gt re tech archive damaged messages priori middle intransitive voice posteriori passive inequities ipa verbs languages
20	https://listserv.brown.edu/archives/cgi-bin/wa?A1=ind1406a&L=conlang	lines lt log gt unmask re 257 b laybalan languages messages priori posteriori conlang coarticulated ejectives ipa jeff jones rollin
20	https://listserv.brown.edu/archives/cgi-bin/wa?A1=ind1405e&L=conlang	lines lt log gt unmask re incorporationlang g 623 r cvauxv letter conlang messages script euml tir verbs lingo human
20	https://listserv.brown.edu/archives/cgi-bin/wa?A1=ind1405d&L=conlang	lines log unmask lt gt re song form governs verb infinitive ipse etc meaning mizoj messages conlang adventures writing ithkuil
20	https://listserv.brown.edu/archives/cgi-bin/wa?A1=ind1405c&L=conlang	lines lt unmask log gt re cleaning book shelves 2 round ot assignment quirk case finnish articles again call lessons
20	https://listserv.brown.edu/archives/cgi-bin/wa?A1=ind1405b&L=conlang	lines lt log gt unmask re based conlangs natural mouth langs body messages david peterson interviewed france germany marking only
20	https://listserv.brown.edu/archives/cgi-bin/wa?A1=ind1405a&L=conlang	lines lt unmask log gt re ot question pretty well gilgamesh language conlang senjecas terzemian again vowels messages written labialization
19	https://listserv.brown.edu/archives/cgi-bin/wa?A1=ind1404e&L=conlang	lines lt log gt unmask re language conlang surpassed written tolkien dyslexics dyslexic friendly scripts back messages facility native your
20	https://listserv.brown.edu/archives/cgi-bin/wa?A1=ind1404d&L=conlang	lines lt unmask log gt re list mailing conlang unusually quiet conlangery m lately messages wals failed surpassed tolkien history
20	https://listserv.brown.edu/archives/cgi-bin/wa?A1=ind1404c&L=conlang	gt lines log lt unmask re historical living writing fire instead firescript ink senejas conlang mailing natlang list miles anthony
20	https://listserv.brown.edu/archives/cgi-bin/wa?A1=ind1404b&L=conlang	gt lines lt log unmask re conlang english cuneiform mode usage thing word informal nonconcatenative messages morphology making copyright brown
19	https://listserv.brown.edu/archives/cgi-bin/wa?A1=ind1404a&L=conlang	lines lt log gt unmask re conlang voynich new manuscript lojban written study messages open lewis tolkien correct again closed
20	https://listserv.brown.edu/archives/cgi-bin/wa?A1=ind1403e&L=conlang	lines lt log gt unmask re english future lewis tolkien question legionnaires oz messages theory writing adinkra break pete kalyan
20	https://listserv.brown.edu/archives/cgi-bin/wa?A1=ind1403d&L=conlang	lines log unmask lt gt re correct latin bretainois usage text tuff nails bretaineis nailscript literally language ot speak daniel
20	https://listserv.brown.edu/archives/cgi-bin/wa?A1=ind1403c&L=conlang	lines lt unmask log gt re odd verb naming forms angosey forty pronouncing rules written messages other words communicating back
18	https://listserv.brown.edu/archives/cgi-bin/wa?A1=ind1403b&L=conlang	lines lt log gt unmask re conlang online really examples conlangs good copyright time sound messages language fonts review how
18	https://listserv.brown.edu/archives/cgi-bin/wa?A1=ind1403a&L=conlang	lines log unmask lt gt re fun time language word digit your toe finger kamakawi messages butterflies flutter ot conlang
20	https://listserv.brown.edu/archives/cgi-bin/wa?A1=ind1402d&L=conlang	re lines log unmask lt gt conlang language brown writing down unwritten templatic morphologies conlangs beast races voynich r messages
20	https://listserv.brown.edu/archives/cgi-bin/wa?A1=ind1402c&L=conlang	lines lt log gt unmask re conlang n research finite messages terms 7771 conlangs animals plants beast brown races technical
19	https://listserv.brown.edu/archives/cgi-bin/wa?A1=ind1402b&L=conlang	gt lt lines log unmask re conlang research daniel messages 10 jeffrey jones rollin languages sentences project postpositions dyirbal question
20	https://listserv.brown.edu/archives/cgi-bin/wa?A1=ind1402a&L=conlang	lines lt log gt unmask re language mid winter ot greetings vs brown david messages theory speak don w00t spelling
20	https://listserv.brown.edu/archives/cgi-bin/wa?A1=ind1401e&L=conlang	lines lt unmask log gt re regularizing spelling english brown anglo noun number declining norman cases messages let conlang translations
20	https://listserv.brown.edu/archives/cgi-bin/wa?A1=ind1401d&L=conlang	lines lt log gt unmask re english spelling regularizing loglangs general conlang esperantist conlanging purpose viability community brown castro messages
19	https://listserv.brown.edu/archives/cgi-bin/wa?A1=ind1401c&L=conlang	lines log unmask lt gt re new year calls yarc project esperantist conlanging community brown daniel messages jeffrey rollin jones
18	https://listserv.brown.edu/archives/cgi-bin/wa?A1=ind1401b&L=conlang	re lines lt unmask log gt important ahead plan designing why orthographies orthography sl new conlanging theory esperantist brown community
19	https://listserv.brown.edu/archives/cgi-bin/wa?A1=ind1401a&L=conlang	lt gt lines unmask log re iberian gothic new brown conlang messages confine phonetics close stupid question lock bogolangs call
20	https://listserv.brown.edu/archives/cgi-bin/wa?A1=ind1312d&L=conlang	lines lt log unmask gt re english yaept dialect sound nyt meta mapping conlang zbb correspondence language adhuc changes library
20	https://listserv.brown.edu/archives/cgi-bin/wa?A1=ind1312c&L=conlang	lines lt log gt unmask re vulcans don speak why loglang conlang well tempered featural alphabet yaept after quick query
20	https://listserv.brown.edu/archives/cgi-bin/wa?A1=ind1312b&L=conlang	lines lt log gt unmask re flags languages barbara consonant vowel shifts ot brown messages conlang ancient primes character future
20	https://listserv.brown.edu/archives/cgi-bin/wa?A1=ind1312a&L=conlang	lines lt log gt unmask re scaron dabi future 1996 257 brown conlang ot padraic 2013 thank messages zr b
20	https://listserv.brown.edu/archives/cgi-bin/wa?A1=ind1311e&L=conlang	257 conlang b zr mani lines log lt gt unmask ot re author table contents strange l christmas seeking brown
20	https://listserv.brown.edu/archives/cgi-bin/wa?A1=ind1311d&L=conlang	lines log unmask lt gt re semantic primes application validity conlanging language cheese ur alphabet morphemeaddict messages albanian day 257
20	https://listserv.brown.edu/archives/cgi-bin/wa?A1=ind1311c&L=conlang	lines lt log gt unmask re word same any language card conlang 2013 exchange req well letters soon sasha pacific
20	https://listserv.brown.edu/archives/cgi-bin/wa?A1=ind1311b&L=conlang	lines lt log gt unmask re young san francisco conlanger area bay bus burned chat speech verb attack reported last
20	https://listserv.brown.edu/archives/cgi-bin/wa?A1=ind1311a&L=conlang	lines lt log gt unmask re conlangs music both conworlds conlang 2013 verb languages marking only terminology verbs agent patient
20	https://listserv.brown.edu/archives/cgi-bin/wa?A1=ind1310e&L=conlang	lines lt log gt unmask music re conlang both conlangs evaluate how take conworlds j rhiemeier ouml rg patient only
20	https://listserv.brown.edu/archives/cgi-bin/wa?A1=ind1310d&L=conlang	conlang re how lines lt gt unmask log evaluate present some antic space brown ot sophisticated americas languages take native
20	https://listserv.brown.edu/archives/cgi-bin/wa?A1=ind1310c&L=conlang	lines lt unmask log gt re how conlang present native languages americas first music theory popular language xiis writing system
20	https://listserv.brown.edu/archives/cgi-bin/wa?A1=ind1310b&L=conlang	re lines lt gt unmask log conlang french first hangul brown working messages how spoken colloquial resources orthography padraic j
20	https://listserv.brown.edu/archives/cgi-bin/wa?A1=ind1310a&L=conlang	re lines lt gt unmask log french colloquial resources something spoken discuss orthography brown english castro leonardo r indo conlanging
20	https://listserv.brown.edu/archives/cgi-bin/wa?A1=ind1309d&L=conlang	lines lt log gt unmask conlanging john re intro mcwhorter language gateway conscripts brown deep structures conlang padraic messages 4
19	https://listserv.brown.edu/archives/cgi-bin/wa?A1=ind1309c&L=conlang	lines lt log gt unmask re time another tedve l oskana party dabolnea deep structures language onomatopoeia use brown wordpress
