17	http://www.kli.org/	klingon language kli institute qepa member holqed here your opens program questions members wiki learn qonos resources help exploration join
16	http://www.june29.com/HLP/	june29 com welcome defunct web  bringing part find percentage ilovelanguages human page lessons coins wallpapers free internet webchess project
20	http://www.itu.dk/~sestoft/mosml.html	ml moscow standard 2 sml pdf documentation pages postscript implementation university net version library sestoft 01 created mosml peter language
18	http://www.ign.com/articles/2017/08/12/gamescom-2017-star-wars-battlefront-2-space-battles-teased	star wars ign battlefront game new 2 6 2017 ii gamescom space year pc more artboard battles nintendo man sky
16	http://www.hmco.com/	hmh your sign online education 2017 help corporate spark account institutional booksellers learning schools houghton more classroom books mifflin leading
15	http://www.harpercollins.com/	harpercollins books book new free fiction your authors republic services read shipping email off e romance sale plus bestsellers reading
17	http://www.filmla.com/getting_started.php	permit your filml film application filming credit requirements fees government once production charges refund location days permits request please final
17	http://www.drupal.org/project/barlow	drupal search view barlow ago years security org extend theme code 2 docs policy project anarcat new report issues open
19	http://www.discoverlosangeles.com/	la more los read angeles l hotels view travel add full builder login discover see things experience august find beach
17	http://www.daerons.co.uk	wp php require websites linuxpackage22 123reg da daerons uk includes html public co er once db function load local share
20	http://www.cep.unt.edu/bree.html	tolkien bree beyond mensa special issue interest group american march nancy martsch art 2005 panel awards r publication fan return
16	http://www.bookfinder.com/	books search bookfinder find new textbooks book com any site used edition print isbn justbooks bull editions best price signed
18	http://www.bibliofind.com/	robot characters see image sure  sorry re results your accepting try continue conditions privacy 1996 amazon inc affiliates com
18	http://www.bewaterwise.com/	water california rebates campaign saving resource garden videos view use h2love your education save toolkit landscape metropolitan conservation classes programs
10	http://www.adobe.com/products/golive/main.html	adobe cloud creative your english design more dreamweaver solutions support products learn mobile web new apps time now view pdf
15	http://www.abebooks.com/	abebooks books com art book shop find search passion signed your browse more explore fine posters sell help collections editions
19	http://wouter.fov120.com/false/	gt false lt 1 language br copy interpreter 0 f code just looks factorial made implementation here portable written programs
19	http://tolklang.quettar.org/quetinfo	quettar redirection  www should moment last thu 11 47 bst 2009 36 14 jun modified tolklang redirected org please
16	http://sonicfanon.wikia.com/wiki/Sonic_Fanon_Wiki	wiki your david new sonic characters community article character page d how featured think help here him really smash other
19	http://neighborhoodinfo.lacity.org/	neighborhood city area planning district council community los school contact parking station state angeles  14410 st blvd ave officials
18	http://mbcla.lacity.org/	los angeles business mbda minority city center honorees program california million southern development contact services national annual awards university partnership
19	http://kotaku.com/fan-video-recreates-old-character-intros-in-street-figh-1797787838	ethan street fighter game video character series some intros best 2 fan over recreate sfv animations videos lot gach team
19	http://github.com/safarijv	updated python 2017 forked django c 2016 2 objective 1 javascript 11 7 mar 3 html ios 10 smooch sbo
15	http://finance.lacity.org/content/Permits.htm	permits alarm permit your information search online required payment card credit los angeles renew tobacco contact police public non fire
19	http://fairuse.stanford.edu/	copyright 2017 law court v office august 2014 2016 inc may design infringement llc stanford university published filed fair more
16	http://ewddlacity.com/index.php/development/business-financing	business development incentives program city loan financing los angeles 5 back 000 new jobs information ewdd programs 213 projects time
18	http://elpueblo.lacity.org/	el pueblo angeles los city olvera street opportunities commission site entertainment history map calendar sub exhibits museums contact de events
20	http://disclaimer.lacity.org/disclaimer.htm	any city translate site los angeles may googletm translation information use damages contained including such materials disclaimer without does provided
20	http://culturela.org/	00 august cultural art city angeles los dca arts icon culture grants programs am centers 19 9 department mural sketch
18	http://comicbook.com/gaming/2017/08/12/disney-sued-spying-on-kids-with-42-mobile-apps-frozen-moana/	2017 disney august fire 12 pokemon star league legends nathan birch comicbook dedmon tanner 2 new apps gaming frozen 1
16	http://clerk.lacity.org/BusinessImprovementDistricts/index.htm	business improvement city districts council district contact map clerk records search list la meetings find links neighborhood archives reference resources
4	http://atty.lacity.org/	 city redirect attorney
16	https://parkit.bikehub.com/Metro/register	your step new password email bike registration california photos name dakota virginia confirm updates receive phone south carolina north bikehub
16	https://intranet.sydney.edu.au	research sydney university august support week staff campus your service intranet news 14 new services faculty log student development planning
20	https://go8.edu.au	go8 2017 media 2016 release may group research eight universities education 2015 higher jun apr australia university submission nov budget
18	http://whatson.sydney.edu.au/	events 2017 sydney august university 00pm more 5 6 award 30pm look read 9 event joan 1 carden exhibition 10
17	http://sydney.edu.au/library/	library study copyright research sydney help unit your collections services university new resources news databases subject open now feedback scholarship
19	http://metro.net/bikes	metro bike your bicycle bikes transit bus transportation projects station rail safety project line parking board open la city program
17	http://inspired.sydney.edu.au/	inspired more read university sydney gift inspires re campaign approach waging save diabetes war giving support search transform largest stories
15	https://www.cnet.com/reviews/	deals home tech apple ago cnet more galaxy best smart price 99 cars samsung iphone security reviews good 00 2017
16	https://upload.cnet.com/	com cbs upload increase downloads help cnet interactive log search zdnet tv techrepublic mysimon moneywatch chow download radio gamespot sign
19	http://zh.community.wikia.com/wiki/	cal boy fandom 2015 02 03 wikia wiki chen js 2 shen 4 1 10 04 3 english ad b8
20	http://yhteiso.wikia.com/wiki/	wikia 2017 kytt fandom community lis english wiki elokuuta eng raportoi lisminen account page ja tekniset viimeisimmt pivitykset start gt
18	http://www.guide.com/	view year old toys best guide gifts your tea water product day prime amazon boysviewbest girlsviewbest 2 interactive cbs top
17	http://www.cbsinteractive.com/legal/cbsi/patents	patents following protected cbs u more other pending com services interactive terms video careers brands advertise 8745639 contact inc may
19	http://nl.community.wikia.com/wiki/	wikia wiki community fandom your university 02 de 2016 hulp van alle centrale ad start page powered explore random deutsch
18	http://legalterms.cbsinteractive.com/terms-of-use	your any access services cbs may content terms interactive other use subscription including user otherwise 8 such period account without
20	http://ko.community.wikia.com/wiki/	wikia miri fandom nae ad sdcc powered english deutsch suomi italiano polski blocker portugus nae10 2 nederlands franais espaol community
17	http://download.cnet.com/blog/download-blog/	software android ios download apps 5 your more 2017 mac blog read google windows topics pm best video friday security
18	https://www.slideshare.net/inmetro	inmetro cookies slideshare privacy gov de website following br uses performance relevant continue site see policy home para www agreement
19	https://www.jic.ac.uk	centre back john innes research norwich wheat impact plant read molecules iron more genes facilities environment news events open 2017
18	https://sourceforge.net/p/gftbox/home/gftbox/	islands republic gftbox saint new sourceforge united south island home guinea providers democratic arab states georgia please french browse resources
20	https://eastanglia.academia.edu/RichardKennaway	graph rewriting terms such language tissue based graphs richard growth lean date systems term computing kennaway computations shape alternative john
18	https://dlandroid24.com/	android game weeks 2 sports ago more read games pool speed riders cup hockey trials graphics free snowboarder stickman let
9	http://zhavukeldi.net/	zhavukeldi net almost here  need admin dreamhost panel help started upload website your
7	http://www2.datasus.gov.br/DATASUS/index.php	 please javascript page content view enable
19	http://www.w3.org/WAI/WCAG1AA-Conformance	content conformance guidelines web 1 w3c level accessibility double 0 use logo accessible users disabilities priority how  claims providers
18	http://www.visicast.cmp.uea.ac.uk	uea project signing esign information virtual society site human research technology visicast language sign avatar  fifth ist undertaken computing
16	http://www.uea.ac.uk/env/	research sciences uea school environmental contact degrees study postgraduate your international students student norwich home information business undergraduate prospectus social
18	http://www.towerofthehand.com/	warning post entries 7 comments your fire game thrones re scope tower blog ice other beyond view discuss hand events
14	http://www.tolkienshop.com/?mid=imladris	tolkien shop books catalogue tolkienshop more items mode com online lord store your middle new additions latest autographs starts home
16	http://www.thedailyprophet.org/	www thedailyprophet org parked owner  here services e may used domain 2017 domeneshop owns actively mail such other website
7	http://www.secom.gov.br/	 please javascript page content view enable
19	http://www.researcherid.com/rid/F-8190-2013	kennaway title times added cited mar author published 16 07 source richard 10 volume pages et al r issue researcherid
16	http://www.mozilla.com/	firefox download browser islands windows your mozilla island 64 linux privacy bit android ios internet system meet more requirements english
20	http://www.linderebros.com/index-en.htm	world saw heart music lind magical where land people come way event feeling light feelings great may dreams  official
20	http://www.glyphweb.com/arda/default.asp	arda tolkien encyclopedia r b 149 e entries words men j races events names chronicle entry calendar news lexicon euml
9	http://www.fundacaocefetbahia.org.br/ebal/concurso.asp	request rejectedthe url think please webmaster support 7957572184783360630 id your contact error rejected requested
18	http://www.flaticon.com/authors/simpleicon	icons your collection collections 9 premium simpleicon download use how them thanks create free flaticon delete author active send edit
20	http://www.dlstewart.com/neil/	unifon alphabet stories stewart site words neil character using spelling pdf story below vocabulary reader proposals each reading read child
8	http://www.bornofhope.com/	 born lord fan prequel film rings hope
3	http://www.annalsofarda.dk	 annals arda
16	http://wordpress.org/	wordpress blog plugins web sites over download release 8 4 hosting more your org involved website features widget powerful beautiful
18	http://virushead.net/	virushead original mood  explore blog church poetry loss jr pages free clicks uarr headline internet count site dreamhost mine
20	http://unifon.org/	unifon john dr grade english ratz teaching times read 2012 reading org why culkin mom resources program instead over sound
14	http://system13.org/	fa help your system13 wealth coaching call 0855 9 415 twitter plus square home life management other need time label
13	http://support.scribd.com/entries/107868373-Scribd-Accessibility-Policy	accessibility scribd website mobile working use ensure help subscribers site web policy guidelines re need more text com how feedback
9	http://sf.kjempekjekt.com/	domain kjempekjekt com  instructions sale privacy policy backorder may renewal name expired
18	http://orcid.org/0000-0001-9702-644X	work details value orcid sourcename source url putcode workssrvc view show sources citation your use hide null preferred title richard
16	http://kieben.com/ring/	direct tolkien lotr linking ring top sites link your net e read heart le warning links fantasy images theft bandwidth
20	http://journals.plos.org/ploscompbiol/article?id=10.1371/journal.pcbi.1002071	growth polarity specified case tissue field strain canvas article cell view model j google shape ncbi pubmed figure scholar rates
16	http://journal.neilgaiman.com/	neil gaiman 2017 year m new things people com read book time here even them gods some where doing evening
17	http://gmpg.org/xfn/	xfn xhtml network friends tools thanks other feedback use values how home web faq lt gt href gmpg write examples
18	http://georgerrmartin.com/	news wild cards read more george r awards 2016 world book 2017 winds hbo new august thrones game winter fans
17	http://folkvangar.com/store/	art newsletter folkvangar scrapbooking characters fantasy 0 gift shipping q f license home links contact subscribe certificate faq  veronica
12	http://fantasyrealmcreations.com/index.html	fantasy realm creations  visit online here 2016 copyright gallery deviantart please mj albert
17	http://e-publications.khm.de/	search documents publish library publication welcome want e university khm publications please menu document  offers generated members free after
17	http://del.icio.us/post?title=+&url=http%3a%2f%2fwww.navarra.es%2fNR%2fexeres%2fA0D2A523-BCB0-4D12-B927-629698CCF706.htm	sign tags your email address delicious facebook password twitter cancel link google add tag forgot rename type send account search
20	http://cmpdartsvr3.cmp.uea.ac.uk/wiki/BanghamLab/index.php/Software	et al 1 shapes 3 2 growth software photoartmaster images how analysing used growing control download art set open cell
19	http://bridgetothestars.net/	pullman philip book oxford 2017 new comments la reviews sauvage read dust belle jaya posted august times bookshops auction net
19	https://www.campervanfinder.com.au	locations 00 operates australia campervan new vehicles zealand 2 camper campervans brisbane sydney apollo cairns melbourne available sleeps hippie cheapa
14	https://bebusinessed.com/online-payroll/free-payroll-software/	payroll software quickbooks free how online intuit your per business month employees 30 pay patriot review need linkedin trial tax
18	https://academichelp.net/	writing letter 5 3 2 essay guides 4 business academic your paper samples 1 login assignment 0 write students statement
13	http://www.oxagile.com/services/web-development/	development web oxagile services your expertise mobile custom video app 2017 software project company time contact e featured free platform
17	http://www.naplespelicanbayproperties.com/	bay pelican naples real estate community property 2 condos st search homes 3 sq fl 34108 colony bath bed 000
19	http://www.lewesseo.com/web-design/	page found sorry 01273 257038 lewes quote seo call st  blog 100 homepage lewesseo james sussex just really form
19	http://www.languagelearningsoftware.com/	language rocket rosetta stone learning learn best languages software arabic french spanish your italian how german hindi japanese korean pimsleur
20	http://www.justinhavre.com/sitemap.php	000 ft calgary 2 500 1 3 4 5 7 6 8 9 listings 100 west acres 200 900 800
15	http://www.bingobuddha.co.uk	bingo more 2015 2014 read category online fun best buddhas view latest news some free july tombola many stuff 2016
15	http://travlang.advertserve.com/advertpro/servlet/click/zone?zid=19&pid=0&lookup=true&position=1	travlang language travel downloadable courses bookstore spanish reservations new translators electronic web foreign com dictionaries translation  professional chat world
17	http://naplesluxurywaterfrontproperties.com/	naples real estate waterfront luxury 000 5 fl royal bath bed bay ft sq corey 4 homes cabral property 6
19	http://dictionaries.travlang.com/	dollars travlang new language pesos francs pounds ounces south polish spanish korean travel york dictionaries czech dutch portugus hungarian italian
18	http://chat.travlang.com/	chat touring travlang language java web paul foreign dictionaries burchard world translation word day your travel resources other  facts
12	http://4k.com/tv/	4k tv tvs reply samsung hdr 2016 2015 am inch best sony models model your pm more some also hd
15	https://safeweb.norton.com/report/show?url=store.empiricus.com.br	norton web safe site 0 your com community rating sign symantec review threats report empiricus feedback leave reviews name tags
19	http://www.python.org/	gt python 3 2017 news events more community 2 6 docs available 08 code other lists development product software print
16	http://www.mysql.com/	mysql oracle cloud enterprise more edition service cluster 2017 downloads documentation learn contact services august zone guide products developer database
18	http://www.huc.edu/	jewish 2016 speaker featured new your jir education applicationprogram requirementsapplication school huc become book rabbi nonprofit d college programfor advisor
17	http://www.closed-circle.net/	closed new comments news books circle more physical mail short cj 2013 jsf1000 cherryh through please abbey now site only
17	http://www.apache.org/	apache community software projects open news 0 code week overview source 2017 more foundation support asf bookkeeper wicket web datafu
12	http://www.angelfire.lycos.com/	website builder angelfire domain professional styles site more free your name learn service login other user tools password shopping cart
16	http://statcounter.com/	your statcounter free web stats insights visitors features installation user how growth plan site guides blog visitor account app counter
20	http://en.wikipedia.org/wiki/Gust_Corporation	yes playstation atelier 2 alchemist gust 3 06 marie 0000june games game alchemists vita salburg 2014 02 1 28 01
19	http://cherryh.com/WaveWithoutAShore	e cj book 2017 books closed circle journal 1 software foreigner jane jul terra cotta new warriors calibre author aug
18	https://techsolidarity.org/	tech solidarity events san person assistance regular ceglowski maciej francisco  los new portland washington grass organization goal connect communities
16	https://password.southern.edu/	javascript web browser sign required account your  see keep 2013 passwordcreate microsoftforgot signed organizational help enable support enabled supports
18	https://mythsoc-rohan.blogspot.com/	mythopoeic 2017 email mythcon society room 1 awards posted twittershare share thisblogthis pm comments pinterest 48 facebookshare july award labels
19	https://myaccess.southern.edu/apps/Campusdirectory/departments.aspx	southern edu www https hall see services wright 2nd 1st student wood lynn center school 3rd campus department plant management
19	https://c.xkcd.com/random/comic/	bad movie xkcd three lt comics gt worse good com graph prev random https feed special through drops quality below
15	http://www.webring.com/h/terms	webring any service your content agree such other may use information tos site available inc email time services web otherwise
20	http://www.smbc-comics.com/	comic forumaugust 2017discuss 9 bahfest soonish permalink 2017 houston discuss book smbc weinersmith  saturday breakfast evil tap probably heard
17	http://www.jspowerhour.com/	birthday rituals  power last course pizza doom once loop hey extra bought new mesozoic donate artist patreon support contact
16	http://www.insidevoa.com/	voa news voice america search visit more skip contact awards subscribe media information history press tour studio next previous 75
19	http://www.buttercupfestival.com/	poetry pound 00 gbp series birds copies buttercup festival troupes world page david recent ni britain great sketchbook new also
17	http://www.boutell.com/gd/	gd library graphics source web other open com dynamic images available anything probably need compiling moved re most c code
19	http://www.YourTakeOnScience.com/go?ring=conlang;id=43;ac=%40%03yglTEB%B1%BF%A9%90%D0%DE%B4%BE%A4%E4%C7%DD%8Bpf5NN_%26%278O%08%1A%12%A6%FF%F4%C9%D6%CD%AA%A5%F6%8A%83%93gt8H%5EY;go	language lojban languages com loglan mailing list esperanto 1051 1086 1085 1072 la some translator world logical 1073 1078 dictionary
17	http://womenalsoknowstuff.com/	women scholar listed scholars also know website stuff area visit other here political search please list become database page news
19	http://voanews.com/rss.html?tab=Podcast	voa africa subscribe 00 itunes news 23 newscasts podcast live 30 listen u health world talk join program correspondents asia
20	http://suberic.net/~dmm/rikchik/language/dictionary.html	rikchik emotion glyph morphemes above around art angry after across beach big bouncer change child choice cloth crab crystal disgust
18	http://questionablecontent.net/	your ad right here 0 now cast first next qc previous random last  questionable august 2017 other comics bunny
17	http://pronounce.voanews.com/	browse search al hot pronunciation contact pronounce guide help voa u ee region ah oo  quickly helped around challenging
20	http://projects.voanews.com/south-china-sea/	china south sea maritime u waters disputed chinas vietnam claims beijing nations chinese philippines international artificial also asean island islands
18	http://pbfcomics.com/	perry bible fellowship nicholas splitting lt gurewitch time upmetamorph view first assist  information purchases page new available favorites archive
18	http://editorials.voa.gov/	aid view washington search recovery punto isis vista de editorials rights more security u human voice next europe skip syria
19	http://dir.webring.org/rw?r=conlang	lojban 1 site language en le mdash francais based words post webring gt constructed project initiated 1950s spoken written now
18	http://community.livejournal.com/rikchiktalkhome/	rikchik n quality 0 1 language 2 institute end pm post comment should could p page may walk year use
18	http://buttersafe.com/	2 buttersafe back follow thursday school cool him 2017 10th august sale  tuesdays facebook words them store share ad
20	http://blogs.voanews.com/student-union/	2017 comment reading continue students college august student leave studying posts how international 1 academics u studentu voa south educationusa
16	http://TheShopsAt.webring.org/market	0 sell login signup featured listings items view your 1 item faq username categories more member service search terms buyer
16	http://TheShopsAt.Webring.org/market	0 sell login signup featured listings items view your 1 item faq username categories more member service search terms buyer
17	http://S.webring.com/wrman?ring=conlang&addsite	login signup your email view close password member loading clicking button terms processing please wait mdash service agree let already
19	https://www4.nau.edu/cas/Plan-Dev/CAS-NACC_FULL.html	services campus nau facility maintenance student building responsible fire arizona skip operations office university online safety resources water design life
19	https://www.portoflosangeles.org/	port los angeles la waterfront plan more video harbor view 2017 container community read program tour ports pedro san through
16	https://www.iinet.net.au/home	nbn broadband your ready plans adsl2 view available address net home naked fibre phone more cable pre off expected nbneta
16	https://toolbox.iinet.net.au/	your login account password toolbox username contact iinet ll details visit find enter  description service forgotten tips recovery retrieve
17	https://temps.lancaster-university.co.uk	more lancaster service per hour how 2017 student changed page your students location west apply date aug posted north 8
15	https://geo.itunes.apple.com/us/app/metro-bike-share-official/id1121738367?mt=8&ls=1&at=1000lcZ9&ct=website	apple itunes bike menu share open app your metro store close transit bicycle systems official iphone music find new shop
17	https://app.e2ma.net/app/view:Join/signupId:1702534/acctId:1701634	your name edu  sign staying oriental please moment profile allows serve click button etablet additional also through boxes last
19	http://www2.nau.edu/rdr/SolSys	nau best information networked solar system new scenario learning teaching into riner reed integrating 2006 simulation 1994 html  using
14	http://www.usatoday.com/tech/news/2003-01-02-email-book_x.htm	garg words e mail day home tech com word more news space life your usatoday sports science english usa frequently
15	http://www.stonefish.co.uk	recruitment stonefish system software online erecruitment them hr applicants process applications selection time applicant panel members support email application web
16	http://www.nau.edu/	nau campus student arizona overview flagstaff northern university world research media more apply every home here information engagement search admissions
13	http://www.mika.cc	mika online marketing michael karczewski specialist problem also domain more com over unknown seo m based domains outside solutions box
18	http://www.efstop.at	efstop home  christoph fountain playground1 show blog konzerte 2012 woods contact rssfacebooktwitter copyright impressum polaroid into fotomarathon gallery content
