19	https://listserv.brown.edu/archives/cgi-bin/wa?A1=ind0806c&L=conlang	re lt log lines unmask gt conlang bunty messages language un anti passive making usage your sound nice ot phonetic
20	https://listserv.brown.edu/archives/cgi-bin/wa?A1=ind0806b&L=conlang	re lines unmask log lt gt langmaker down january since ot cals exhibit continues coverage j features double messages beta
20	https://listserv.brown.edu/archives/cgi-bin/wa?A1=ind0806a&L=conlang	lines log unmask lt gt re ot page orthography kamakawi looking dutch children song j english messages semantics simpler iw
19	https://listserv.brown.edu/archives/cgi-bin/wa?A1=ind0805d&L=conlang	lt lines log unmask re gt question latin pronunciation quick time yaept uu ii ot zone middelsprake j philip english
19	https://listserv.brown.edu/archives/cgi-bin/wa?A1=ind0805c&L=conlang	lines log unmask lt gt re time date cindu yearly update j conlang mark reed cloakroom 2008 messages dakota south
20	https://listserv.brown.edu/archives/cgi-bin/wa?A1=ind0805b&L=conlang	lines log unmask re lt gt ot yaeut lexical variation survey spanish feliz da booze words cloakroom j conlang room
19	https://listserv.brown.edu/archives/cgi-bin/wa?A1=ind0805a&L=conlang	lines log unmask re gt lt lexical variation yaeut survey ot preverbs j spanish da feliz verb classifiers tech icelandic
19	https://listserv.brown.edu/archives/cgi-bin/wa?A1=ind0804e&L=conlang	lines lt unmask log gt language re conlang standard world font average atlas sign question european tech messages structures author
20	https://listserv.brown.edu/archives/cgi-bin/wa?A1=ind0804d&L=conlang	lines log unmask re lt gt list dead forms comlang language personal mr world atlas address structures german v distinction
20	https://listserv.brown.edu/archives/cgi-bin/wa?A1=ind0804c&L=conlang	lines log unmask lt gt re able romconlang spade shovel j usage want shifting mark reed messages standard average european
19	https://listserv.brown.edu/archives/cgi-bin/wa?A1=ind0804b&L=conlang	re lines log unmask lt gt tech philip case system j benct standard average european jonsson ot mark reed needed
19	https://listserv.brown.edu/archives/cgi-bin/wa?A1=ind0804a&L=conlang	re lines unmask log lt gt romance pilovese language family pequeno left right conlang benct most philip case system jonsson
19	https://listserv.brown.edu/archives/cgi-bin/wa?A1=ind0803e&L=conlang	lines lt log gt unmask re pilovese other sentences name languages philip irrealis finite non mood conlang verbs messages appearance
18	https://listserv.brown.edu/archives/cgi-bin/wa?A1=ind0803c&L=conlang	re lines unmask log lt gt another conlang glossotechnia playtesting report j languages name terminology language query needs l3 messages
20	https://listserv.brown.edu/archives/cgi-bin/wa?A1=ind0802c&L=conlang	re lines unmask log lt gt conlanging constraints difthongization across ot theory natlangs europa messages conlang anglic languages benct philip
20	https://listserv.brown.edu/archives/cgi-bin/wa?A1=ind0802b&L=conlang	lines log unmask lt gt re conlanging journaling conlang old messages books collection amazon romance evolution pete answer l3 draconic
18	https://listserv.brown.edu/archives/cgi-bin/wa?A1=ind0802a&L=conlang	lines log unmask lt gt re vivitne haec tabella unicode use private tech area tengwar csur language ot free rice
20	https://listserv.brown.edu/archives/cgi-bin/wa?A1=ind0801e&L=conlang	log unmask lines lt gt re conlang proposal together bring communities calendar current year 2012 call articles journal planned philip
20	https://listserv.brown.edu/archives/cgi-bin/wa?A1=ind0801d&L=conlang	re lines log unmask lt gt conlang proposal bring together communities ot gay left bearded handed lithuanian origins conlanger j
20	https://listserv.brown.edu/archives/cgi-bin/wa?A1=ind0801c&L=conlang	lines log unmask re lt gt conlang fluency survey ot maps celestial lcc timing location j messages sick language project
20	https://listserv.brown.edu/archives/cgi-bin/wa?A1=ind0801b&L=conlang	re lines log unmask lt gt ot maps celestial constructed gmp j y philip reed mark romconlang messages jonsson benct
19	https://listserv.brown.edu/archives/cgi-bin/wa?A1=ind0801a&L=conlang	lines log unmask gt lt re ot conlang 92 conworlding commonality thereabouts strictly messages christmas gmp your english translation curren
18	https://listserv.brown.edu/archives/cgi-bin/wa?A1=ind0712e&L=conlang	lines log unmask lt gt re stress ot justifying pattern plus joke last templates name conlang your opinion sylvester messages
20	https://listserv.brown.edu/archives/cgi-bin/wa?A1=ind0712d&L=conlang	log unmask lines lt gt re ot conlang christmas whatever latin subject verb chat agreement messages mncl5 really j long
20	https://listserv.brown.edu/archives/cgi-bin/wa?A1=ind0712c&L=conlang	lt lines log unmask re gt english ot phonology morphology yaept j low vowels briefly variants n y messages whatever
20	https://listserv.brown.edu/archives/cgi-bin/wa?A1=ind0712b&L=conlang	re lt lines log unmask gt ot english vowels yaept vowel latin verb subject agreement y n variants front rounded
20	https://listserv.brown.edu/archives/cgi-bin/wa?A1=ind0711d&L=conlang	lines log unmask re lt gt langauge constets plural morpheme natural metalanguage semantic messages cat conlang mncl5 fwd phonemes building
19	https://listserv.brown.edu/archives/cgi-bin/wa?A1=ind0711b&L=conlang	lines log unmask re lt gt conlang names ot fantasy natlangs worlds science don interesting off fuck agree name case
19	https://listserv.brown.edu/archives/cgi-bin/wa?A1=ind0711a&L=conlang	lines log unmask lt gt re question tech diacritics page 2nd verb take j terkunan philip messages terminology postpositions prepositions
20	https://listserv.brown.edu/archives/cgi-bin/wa?A1=ind0710d&L=conlang	lines log unmask lt gt re omicron sigmaf lambda omega rho delta tau phi iota theta chi epsilon 941 aesthetics
18	https://listserv.brown.edu/archives/cgi-bin/wa?A1=ind0709e&L=conlang	re lines log unmask lt gt theory yaept placement stress ypositional xpositions languages new messages x post pre y conlang
18	https://listserv.brown.edu/archives/cgi-bin/wa?A1=ind0709d&L=conlang	lines log unmask re lt gt languages countries national names help latin some theory xpositions y pre x ypositional post
18	https://listserv.brown.edu/archives/cgi-bin/wa?A1=ind0709c&L=conlang	lines log unmask re lt gt tech dm introducing week first messages day nna philip new electronyms conlang 275 member
20	https://listserv.brown.edu/archives/cgi-bin/wa?A1=ind0709b&L=conlang	re lines unmask log lt gt banjo ot greek old strummin ouml plurals karavano la relex electronyms article conlangs interesting
20	https://listserv.brown.edu/archives/cgi-bin/wa?A1=ind0708e&L=conlang	lines lt log gt unmask re theory reduction final consonants eak numerals conlang corrected reply page messages philip english newton
20	https://listserv.brown.edu/archives/cgi-bin/wa?A1=ind0708d&L=conlang	lines log unmask lt gt re conlang article la times theory relation between trial counting bucket messages plural si fadawana
20	https://listserv.brown.edu/archives/cgi-bin/wa?A1=ind0708b&L=conlang	lines log unmask lt gt re conlang john terkunan messages azurian c lingwa de planeta another english question acadon j
20	https://listserv.brown.edu/archives/cgi-bin/wa?A1=ind0708a&L=conlang	re lines log unmask lt gt de planeta lingwa chat conscripts ldp introductory course few questions brr linguistics question concerning
18	https://listserv.brown.edu/archives/cgi-bin/wa?A1=ind0707e&L=conlang	re lines lt unmask log gt few questions linguistics concerning new project ot graffitum sic brr messages conlang just m
20	https://listserv.brown.edu/archives/cgi-bin/wa?A1=ind0707d&L=conlang	lines log unmask re lt gt last enemy teliya nevashi grammar beginnings ot messages 1 michael poxon j adventures idiocy
18	https://listserv.brown.edu/archives/cgi-bin/wa?A1=ind0707b&L=conlang	lines log unmask lt gt re j digraphs loup phonology here garou plan b jeff rollin messages mark reed relay
19	https://listserv.brown.edu/archives/cgi-bin/wa?A1=ind0707a&L=conlang	lines log unmask lt gt re jeff rollin j chat poll looks best english velian messages rhotics orthographic mark reed
20	https://listserv.brown.edu/archives/cgi-bin/wa?A1=ind0706e&L=conlang	re log unmask lines lt gt compounded compounds chat know mom conlanging dad conlang vowels doing without relative clauses conditionals
20	https://listserv.brown.edu/archives/cgi-bin/wa?A1=ind0706c&L=conlang	lines log unmask re lt gt languages reverse mir kalt ist how sentence analyze constructed polysemy maps j 2007 reed
19	https://listserv.brown.edu/archives/cgi-bin/wa?A1=ind0706a&L=conlang	lines log unmask lt gt re allophone problem comparatives difficult messages theory polysynthetic holes new language secondary w vs philip
18	https://listserv.brown.edu/archives/cgi-bin/wa?A1=ind0705a&L=conlang	re lines unmask log lt gt conlang list sine graeca flexione mailing dead down server article deleted wikipedia most bod
19	https://listserv.brown.edu/archives/cgi-bin/wa?A1=ind0704e&L=conlang	re conlang lines log unmask lt gt usage ic al most developed making modifiers nouns nineteen ot j unearthed sketch
19	https://listserv.brown.edu/archives/cgi-bin/wa?A1=ind0704d&L=conlang	re lines unmask log lt gt conlang most developed language rise 1 messages year nineteen sketch unearthed old jim henry
19	https://listserv.brown.edu/archives/cgi-bin/wa?A1=ind0704c&L=conlang	log unmask lines re lt gt conlang most developed rise j 1 messages henrik theiling 2 interestin legends nations cuotl
18	https://listserv.brown.edu/archives/cgi-bin/wa?A1=ind0704b&L=conlang	log unmask lines re lt gt underlining naming conventions messages tech 2 babel text glossing new last conlang j gzb
20	https://listserv.brown.edu/archives/cgi-bin/wa?A1=ind0704a&L=conlang	lines log unmask lt gt re 1 chat c greek alphabet j question messages author 2 polysynth 101 conscripts want
20	https://listserv.brown.edu/archives/cgi-bin/wa?A1=ind0703e&L=conlang	lines log unmask lt gt re author consummatum est sandhi kijeb want j hear payne thomas speak morphosyntax describing messages
18	https://listserv.brown.edu/archives/cgi-bin/wa?A1=ind0703d&L=conlang	lines log unmask re lt gt day j question post mark reed first messages presenting website classical alyis phonetics navigation
19	https://listserv.brown.edu/archives/cgi-bin/wa?A1=ind0703c&L=conlang	lines log unmask lt gt re copula language messages persons j conlang wakat unknown usage first inclusive languages post ai
20	https://listserv.brown.edu/archives/cgi-bin/wa?A1=ind0703b&L=conlang	lines log unmask lt gt re sound conlang change numbers historical puzzle messages coming finding joseph community stories fatula first
19	https://listserv.brown.edu/archives/cgi-bin/wa?A1=ind0703a&L=conlang	lines log unmask lt gt re conlang new terkunan messages specgram current plug issue language ot yitzik basilius met kiev
20	https://listserv.brown.edu/archives/cgi-bin/wa?A1=ind0702c&L=conlang	lines log unmask re lt gt 1 why consonants 2 weekly repost vocab 8 show based messages terzemian better nouns
19	https://listserv.brown.edu/archives/cgi-bin/wa?A1=ind0702b&L=conlang	log unmask lines re lt gt phonological equivalent additional diacritics 1 time grammar travel language recognition 2 philip messages vocab
20	https://listserv.brown.edu/archives/cgi-bin/wa?A1=ind0702a&L=conlang	re lines unmask log lt gt phonological brown equivalent quick fox philip nor ig z pli test j tsat math
20	https://listserv.brown.edu/archives/cgi-bin/wa?A1=ind0701e&L=conlang	lines log unmask re lt gt test pronunciation keys pli z nor ig j tsat mark grammatical cases accusative ergative
20	https://listserv.brown.edu/archives/cgi-bin/wa?A1=ind0701d&L=conlang	lines log unmask lt re gt how place foreign names pronunce yaept conlangs messages draughts ot signed 2 accusative 1
20	https://listserv.brown.edu/archives/cgi-bin/wa?A1=ind0701c&L=conlang	re lines log unmask gt lt realism retro fitted foreign place how names pronunce messages proposed ipa characters unicode questions
19	https://listserv.brown.edu/archives/cgi-bin/wa?A1=ind0701a&L=conlang	re lt lines unmask log gt happy year new 3b ot conlang translation speaking books spot language messages 2 spanish
19	https://listserv.brown.edu/archives/cgi-bin/wa?A1=ind0612e&L=conlang	log unmask lines lt gt re translation spanish needed gender conlang 1 christmas zhang hanuman happy year new 2 j
20	https://listserv.brown.edu/archives/cgi-bin/wa?A1=ind0612d&L=conlang	lines lt unmask log gt re question english secondary speakers zbb posted also predicates 1 lcc needs vowels gender 2
19	https://listserv.brown.edu/archives/cgi-bin/wa?A1=ind0612c&L=conlang	log unmask lines lt gt re 1 2 gender language repost vocab weekly messages declension 3 non help conlang 7
19	https://listserv.brown.edu/archives/cgi-bin/wa?A1=ind0612b&L=conlang	log unmask lines lt gt re topic seperate questions rhoticity languages comment messages just usage verbs sally caves philip criteria
19	https://listserv.brown.edu/archives/cgi-bin/wa?A1=ind0612a&L=conlang	log unmask lines lt gt re 2 conlang messages criteria your others own languages non verbs 1 henrik theiling archives
19	https://listserv.brown.edu/archives/cgi-bin/wa?A1=ind0611d&L=conlang	lines log unmask lt gt re ot paypal completely does suck language 1 j messages translation challenge help usage mark
20	https://listserv.brown.edu/archives/cgi-bin/wa?A1=ind0611c&L=conlang	lines log unmask lt gt re connglish 1 ot language built around novel grammar essentialist another explanation completely does paypal
20	https://listserv.brown.edu/archives/cgi-bin/wa?A1=ind0611b&L=conlang	frac12 lines log unmask iuml iquest lt gt re 1 yaept h para 8 th voiceless ng test atilde 132
19	https://listserv.brown.edu/archives/cgi-bin/wa?A1=ind0610e&L=conlang	lines lt log gt unmask re help general purpose dictionary ot generator 1 mandarin participation clbp messages portuguese brazilian sorry
20	https://listserv.brown.edu/archives/cgi-bin/wa?A1=ind0610d&L=conlang	lines log unmask re lt gt 1 stress consonants dictionary german generator siezen duzen etymology purpose general list messages amanda
20	https://listserv.brown.edu/archives/cgi-bin/wa?A1=ind0610c&L=conlang	log unmask lines gt lt re conlang duzen german etymology siezen sentences 1 comparison messages conlanging books cl101 asp evangelism
20	https://listserv.brown.edu/archives/cgi-bin/wa?A1=ind0610a&L=conlang	lines lt unmask log gt re infinitive kick how habit conlang 1 grammars using creating infinitives prototypes messages gerunds linguistics
18	https://listserv.brown.edu/archives/cgi-bin/wa?A1=ind0609e&L=conlang	1 conlang lt lines gt unmask log 5 page links 2 repost view vocab weekly re transcription messages author contents
20	https://listserv.brown.edu/archives/cgi-bin/wa?A1=ind0609d&L=conlang	re lines lt unmask log gt 1 transcription exercise conlang accusative ot messages systems weekly vocab dictionaries sections number philip
20	https://listserv.brown.edu/archives/cgi-bin/wa?A1=ind0609a&L=conlang	1 lines unmask log lt gt re lexicon weekly vocab counting repost messages syntactic differences parts within ot speech storage
19	https://listserv.brown.edu/archives/cgi-bin/wa?A1=ind0608e&L=conlang	lines log unmask lt gt re 1 ot back m syntactic parts within differences messages speech seriously request demotion pluto
20	https://listserv.brown.edu/archives/cgi-bin/wa?A1=ind0608a&L=conlang	lines lt unmask log gt re ot messages english conlang method flavored german generating nor another words world flag description
20	https://listserv.brown.edu/archives/cgi-bin/wa?A1=ind0607e&L=conlang	re lines log lt gt unmask german translation challenge foucault left delexicalization usage pendulum gender wikipedia messages right another eine
20	https://listserv.brown.edu/archives/cgi-bin/wa?A1=ind0607d&L=conlang	re lines lt gt unmask log another ozymandias messages changes polite second person fuit pronouns english translation sound sally caves
16	https://listserv.brown.edu/archives/cgi-bin/wa?A1=ind0607c&L=conlang	log unmask lines lt gt re ot theory languages website conlang fusion grammar messages conlangs your j order new book
19	https://listserv.brown.edu/archives/cgi-bin/wa?A1=ind0607a&L=conlang	lines lt log gt unmask re music language conlang conlangs messages tech saying languages wordless nonverbal ot j question books
19	https://listserv.brown.edu/archives/cgi-bin/wa?A1=ind0606e&L=conlang	lines lt log gt unmask re conlang nonverbal language chat german help wordless messages urls tiny theory anyway ot australian
20	https://listserv.brown.edu/archives/cgi-bin/wa?A1=ind0606d&L=conlang	lines lt log gt unmask re ot words those irregular prepositions how defining conlang used nonverbal messages usage tinkering versus
19	https://listserv.brown.edu/archives/cgi-bin/wa?A1=ind0606c&L=conlang	lines log unmask lt gt re schwa learning v ipa translation messages most texts translated j conlangs natlangs language mills
20	https://listserv.brown.edu/archives/cgi-bin/wa?A1=ind0606b&L=conlang	re lines unmask log lt gt con usage graphies shaw alphabet names yaept j ot v learning schwa ipa track
20	https://listserv.brown.edu/archives/cgi-bin/wa?A1=ind0606a&L=conlang	re lines log unmask lt gt usage rants di thong f names translation messages challenge j diversity uniformity thank andreas
20	https://listserv.brown.edu/archives/cgi-bin/wa?A1=ind0605e&L=conlang	lines log unmask lt gt re usage di f thong rants tetraphthongs triphthongs may bearded left lithuanian gay handed theory
18	https://listserv.brown.edu/archives/cgi-bin/wa?A1=ind0605c&L=conlang	lines log unmask lt gt re list star trek new place name constituents ot messages conlang non human phonology word
20	https://listserv.brown.edu/archives/cgi-bin/wa?A1=ind0605b&L=conlang	lt gt lines unmask log re conlangs words language conf change messages sound reversible applier conference overview does every family
20	https://listserv.brown.edu/archives/cgi-bin/wa?A1=ind0605a&L=conlang	lines log unmask lt gt re conlangs conf language conference pre brothers law design ideal word messages words creation second
20	https://listserv.brown.edu/archives/cgi-bin/wa?A1=ind0604e&L=conlang	lines log unmask lt gt re does lang cover everything pre conlangs conf conlang registration second conference creation language singing
19	https://listserv.brown.edu/archives/cgi-bin/wa?A1=ind0604c&L=conlang	lines log unmask lt gt re segregating self list more thorn oacute rj morphology terms simpler again tran methods messages
19	https://listserv.brown.edu/archives/cgi-bin/wa?A1=ind0604b&L=conlang	lines log unmask lt gt re conlangs vocabulary tiki messages dying natlangs times michael adams figure machine translation new project
19	https://listserv.brown.edu/archives/cgi-bin/wa?A1=ind0604a&L=conlang	lines log unmask lt gt re conlang thorn rj oacute new tran messages conlangs synthesis index changes sound tendencies ta
20	https://listserv.brown.edu/archives/cgi-bin/wa?A1=ind0603e&L=conlang	re lines log unmask lt gt world negative uralic verbs languages furrin lect own phones various commands ravening numbering course
20	https://listserv.brown.edu/archives/cgi-bin/wa?A1=ind0603d&L=conlang	re lines log unmask lt gt names j furrin own phones lect chess pieces con 2 langs esperanto v messages
20	https://listserv.brown.edu/archives/cgi-bin/wa?A1=ind0603c&L=conlang	lines log unmask lt gt re slogan conlangs conf witty messages ot character unicode pickers think thank how thunk language
19	https://listserv.brown.edu/archives/cgi-bin/wa?A1=ind0603b&L=conlang	log unmask lines lt gt re english conlangs conf middle witty slogan natlag impersonal verbs chat behove etc j new
19	https://listserv.brown.edu/archives/cgi-bin/wa?A1=ind0603a&L=conlang	lines log unmask lt gt re noun conlang conlangs conf compounds tell your story adjective witty slogan j messages extent
19	https://listserv.brown.edu/archives/cgi-bin/wa?A1=ind0602d&L=conlang	re lines log unmask lt gt conlang apparently bizarre phonetics vs phonemics tell your story yeapt vulgar other f j
20	https://listserv.brown.edu/archives/cgi-bin/wa?A1=ind0602c&L=conlang	re lines log unmask lt gt other latins vulgar messages j conlang old z languages te language albic marking active
19	https://listserv.brown.edu/archives/cgi-bin/wa?A1=ind0602b&L=conlang	re log unmask lines lt gt axe old reviving tradition grind ot conlangs messages problem marking help keyboard idiotic tones
19	https://listserv.brown.edu/archives/cgi-bin/wa?A1=ind0602a&L=conlang	re lines log unmask lt gt again greek plosives conlangs language once chat graeca sine flexione messages translations work slogans
20	https://listserv.brown.edu/archives/cgi-bin/wa?A1=ind0601d&L=conlang	lines lt log gt unmask re 2d non writing linear full again ot messages conlang minza spelling reform r sai
19	https://listserv.brown.edu/archives/cgi-bin/wa?A1=ind0601a&L=conlang	lt gt lines unmask log re types numerals theory coins currency ot messages j mark reed paul book report changes
19	https://listserv.brown.edu/archives/cgi-bin/wa?A1=ind0512e&L=conlang	lines log unmask lt gt re why grammar complex subject flag conlang how ot messages conlangs actual types cloth new
20	https://listserv.brown.edu/archives/cgi-bin/wa?A1=ind0512d&L=conlang	log unmask lines lt gt re conlang flag actual cloth ot grammar complex christmas why subject messages holidays vs conlangs
20	https://listserv.brown.edu/archives/cgi-bin/wa?A1=ind0512c&L=conlang	lines log unmask lt gt re pigs invited guinea self segregating morphology glyphica arcana back try arabic shannon gary messages
20	https://listserv.brown.edu/archives/cgi-bin/wa?A1=ind0512b&L=conlang	re lines unmask log lt gt ot english lenition elision dz messages word isolating building index guides non thoughts pronunciation
20	https://listserv.brown.edu/archives/cgi-bin/wa?A1=ind0512a&L=conlang	lines log unmask lt gt re isolating word building thoughts language inflected good look messages equivalent henrik theiling jim henry
18	https://listserv.brown.edu/archives/cgi-bin/wa?A1=ind0511e&L=conlang	lines log unmask lt gt re fewest sounds messages back turf noticed just hail mary tech ot translation linux topic
19	https://listserv.brown.edu/archives/cgi-bin/wa?A1=ind0511d&L=conlang	lines log unmask lt gt re language many translation change messages challenge among poetry 115 luv too cases different how
19	https://listserv.brown.edu/archives/cgi-bin/wa?A1=ind0511a&L=conlang	lines log unmask lt gt re butterflies where live everyone does new messages languages j learning natural unsupervised translation shifting
20	https://listserv.brown.edu/archives/cgi-bin/wa?A1=ind0510e&L=conlang	re lines unmask log lt gt requesting some challenging sentences applicatives messages chat fwd almost well theory ape wasre southern
20	https://listserv.brown.edu/archives/cgi-bin/wa?A1=ind0510d&L=conlang	re lines log unmask gt lt anthroponymics ot messages some challenging requesting sentences english line drop survey calendars offlist colors
20	https://listserv.brown.edu/archives/cgi-bin/wa?A1=ind0510c&L=conlang	re gt lines unmask log lt anthroponymics font ot single messages j display pictograph alphabet any rune 2 graeco latin
20	https://listserv.brown.edu/archives/cgi-bin/wa?A1=ind0510b&L=conlang	re lines lt gt unmask log font single display alphabet any pictograph rune chinese boustrophedon 2 language messages featural alphabets
20	https://listserv.brown.edu/archives/cgi-bin/wa?A1=ind0510a&L=conlang	re lines unmask log lt gt thanksgiving indo european family tree messages tunu ot celtic asiatic dead grammar afro chat
19	https://listserv.brown.edu/archives/cgi-bin/wa?A1=ind0509e&L=conlang	re lines log unmask lt gt language online identifier conlang indo european family tree verbs messages reloaded evaluate nyungan tarsyanian
18	https://listserv.brown.edu/archives/cgi-bin/wa?A1=ind0509d&L=conlang	re lines log unmask lt gt brz plan b revisited long messages pie nostratic circumlocution j rate error cappucino indo
20	https://listserv.brown.edu/archives/cgi-bin/wa?A1=ind0509c&L=conlang	lines log unmask lt gt re celtic afro asiatic consonants messages question r syllabic brown extra d construction j bunch
19	https://listserv.brown.edu/archives/cgi-bin/wa?A1=ind0509b&L=conlang	re lines log unmask lt gt language phoneme system still unnamed x brief survey messages online rational campaign romanisation klingon
20	https://listserv.brown.edu/archives/cgi-bin/wa?A1=ind0509a&L=conlang	log unmask lines gt lt re question german hungarian language marking person messages nouns short henrik theiling phoneme unnamed x
19	https://listserv.brown.edu/archives/cgi-bin/wa?A1=ind0508e&L=conlang	lines lt log gt unmask re language online identifier conlang messages metathesis short jokes question lingual 2 ot scariest sentences
20	https://listserv.brown.edu/archives/cgi-bin/wa?A1=ind0508d&L=conlang	re log unmask lines gt lt conlang messages jokes metathesis lingual person theiling henrik back translation orthography fortuitous m become
18	https://listserv.brown.edu/archives/cgi-bin/wa?A1=ind0508c&L=conlang	re lines log lt gt unmask more plural theory tenses back colloquial german construct experiencers state m time travelers messages
20	https://listserv.brown.edu/archives/cgi-bin/wa?A1=ind0508b&L=conlang	lines log unmask lt gt re old ipa block unicode albic fluid pivot mixed plurals person clusive distinction ex gender
19	https://listserv.brown.edu/archives/cgi-bin/wa?A1=ind0508a&L=conlang	log unmask lines gt lt re quirky theory case nom messages conlang verbs mp3 henrik theiling new subj obj non
20	https://listserv.brown.edu/archives/cgi-bin/wa?A1=ind0507e&L=conlang	lines lt log gt unmask re quirky another language zbb thread song theory case subjects objects henrik theiling conlang messages
