57	http://www2.cmp.uea.ac.uk/~jrk/conlang.html	language languages designed created see also page english euml n constructed some aacute web words other conlang site spoken l
14	https://www.quickbase.com/db/8gnc9xea	your quick base new apps app data create page need find time load report web open support share free records
57	http://www2.cmp.uea.ac.uk/~jrk/conlang.dir/SpeedwordsBackground.html	speedwords dutton language world international nations other speed double book time between british languages any text national words war 1943
57	http://www.zompist.com/syldavian.html	n ouml syldavian auml du v cf l dutch h iuml uuml d pron used mdash eih b here see
40	http://www.zolid.com/zm	jameld te und 2017 vor zolid language site archive matters tes ew int w jist dictionary now eri zm james
34	http://www.xente.mundo-r.com/utl/index.html	utl translation language languages machine into any high human de web quality natural project very other results been text controlled
34	http://www.wordsmith.org/awad/	word day wordsmith words most new today  vocabulary quote quotation english lexicon vocabulario magic services anagram bulletin chat search
0	http://www.winternet.com/~milo/conlangs.html	 constructed pages please see suncat studio them come moved language
36	http://www.webring.org/cgi-bin/webring?ring=conlang;home	mdash language preview flag 1 gt tongues almaqerin grammar page ring post webring site words scattered empire little 10 20
54	http://www.wall.org/~larry/natural.html	language perl learn languages many people natural use don some even various computer more how english means most them other
36	http://www.voanews.com/	voa 00 newscasts 21 live search listen africa health 05 more news science hits 30 after trump skip 22 upcoming
33	http://www.visi.com/~dean/volapuk2.html	oneneck cloud services solutions data hybrid private news azure security ax service microsoft your professional business oracle network 2017 management
10	http://www.uteged.com/	vio uteded wordpress  proudly dyad com theme powered 20167 20168
60	http://www.users.globalnet.co.uk/~vidas/desa.htm	words 2 desa return matrix chat maths 1 contents 3 n word gt syllable topic syllables other book language list
40	http://www.unifon.org/	unifon john dr grade english ratz teaching times read 2012 reading org why culkin mom resources program instead over sound
33	http://www.ultranet.ca/flash/sw.htm	technology life tech trends data solutions digital entertainment because should phishing begin media uniserve house how lifetime memories organize lovers
57	http://www.uib.no/People/hnohf/index.html	quenya tolkien sindarin elvish articles site translated tengwar course languages page language here some also various other see qenya translations
39	http://www.travlang.com/languages/	travlang language languages travel new search resources web word foreign page online dictionaries downloadable discount courses more your day world
60	http://www.tolkiens.net/sprak/index.php	av til og quenya er p det du sindarin ikke sprk tolkiens om som siden med eller qenya alvisk fra
40	http://www.zhavukeldi.com/index.php	og 2007 av 2008 kraftens fantasy om som en siden zha net annet verden blogg andre land vu litt english
60	http://www.tolkiensociety.org/	tolkien society 2017 events posted shaun gunner oxonmoot r july years publications now j ring published book august speakers rise
36	http://www.mythsoc.org/	mythopoeic society overview mythcon news join press 2017 store awards croft brennan janet edited publications inklings circle members more conference
40	http://www.imladris.dk/	og r tolkien imladris den til om en er af j med p sprog vi forum det hans gandalf danmarks
60	http://www.bree.dk/	er det og til en jeg med ogs p du de oplader der har din kan comment rhekocategories continue posted
40	https://opladershoppen.dk/baerbar-oplader/asus-oplader.html	oplader asus 00kr 199 5 19v til 4 5x2 3 du 2 alle p 0 65w 42a 0x1 9 lager
60	http://www.dagens.dk/teknologi/brandfarlige-iphone-opladere-tilbagekaldes-i-tusindvis	er til og med p den du af det om nu en vil ikke se efter sin iphone rig udland
40	http://www.apple.com/dk/support/usbadapter-european/	apple en adapter p du til af iphone og er den med din usb strmadapter 5 w der berrte ombytte
54	http://trendcover.dk/shop/samsung-galaxy-tablets-330s1.html	cover iphone 10 vi af samsung galaxy til har sort vores du plus 6s 6 udvalg er lder monte tilbehr
54	http://meremobil.dk/2014/06/derfor-skal-du-ikke-lukke-apps-paa-iphone-ved-multitasking/	iphone og apps p multitasking ios en er apple til du ikke der den nr tips det 7 applikationer skal
60	http://bree.dk/	er det og til en jeg med ogs p du de oplader der har din kan comment rhekocategories continue posted
60	http://www.tolkien.ru/drauger/	eth euml igrave auml yuml ccedil iuml divide oacute uuml atilde otilde aacute yacute aelig ouml ugrave thorn oslash 02
20	http://u139.26.spylog.com/cnt?f=3&p=0	http tolkien ru drauger openstat 22 htm4 25 23  5 htm11 westron king site22 19992017 russian 22stephen 21 drauger0
38	http://top.list.ru/jump?from=96958	ru mail 1 2 4 45 google facebook 49 48 3 5  57 35 82 youtube 0 ios amsrus
0	http://www.thegeneric.com/Fifthelement/language.html	your browser  site javascript enabled upgrade settings change please cookies requires
40	http://www.sweb.cz/ls78/euransi.htm	xo euransi mai yin dobre doli xer chaire ahdev sztemon libor e amdd datang dee swaagat  welcome vlkommen zayt
36	http://www.suberic.net/~dmm/rikchik/intro.html	rikchik html language rikchiks gd more tentacles planet information browser used page some sphere write practices mating here both eye
30	http://www.stormloader.com/carver/gutrazda/	bluehost web coupon website discount easy hosting support login build use file builder space 95 contact 3 just  codes
20	http://www.spok.demon.nl/	spokanisch archief spocanian archives site  demon bestaat meer nu anymore choice ws fti grse spokani spocania het welcome welkom
30	http://www.specialized.english.net/home.htm	email address your realnames more meaningful name 30  net ads favorite web mobile tablet 35 each only search 7c0a0eb7b61e0deeeb8d04cd324e63770db2fceac28c6508eea9a46a67a536239e76133d03c9d3415deb59fd4ec2c6d10cc93f5052e6993a608a70f3fd4e0255
34	http://www.sil.org/ethnologue/	ethnologue language languages products edition world read sil more international find day 2017 countries lg use 20th contact data 
60	http://www.sfwa.org/members/elgin/Laadan.html	language women languages ladan experiment native them constructed klingon tongue human conlangs novel english perceptions well existing hypothesis information change
57	http://www.rialian.com/elven-language.htm	tarii tulari lis tir elves elven nectaar yyl tai melendil path name word l soul meaning hri elf used desire
60	http://www.redestb.es/personal/msanzl/sotos.htm	en de y anuncios 30 casas gratis muy c ventacasas por muebles venta ofertas cursos n0sotr0s mudanzas economicos contacte maltes
60	https://www.anuncioneon.es/anunciosgratis/inmobiliaria/	de en metros zona piso habitaciones venta superficie anuncioneon barcelona capital madrid casa andoain alquiler 3 000 gipuzkoa boadilla del
60	https://www.modelofactura.es/	de que factura el la en y un para del una los es hacer o si por con poner iva
60	http://www.contratodealquiler.es/	de el la que en y contrato del se los alquiler o por un vivienda para es las 2014 lo
60	http://www.contratocompraventa.es/	de que el la en un y contrato es del para compraventa lo o una los se hacer por con
60	http://blog.anuncioneon.com/	de en que y anuncios es los anuncio el una anuncioneon por tu para un lo la comentarios hay sobre
38	https://www.blogger.com/post-edit.g?blogID=311230365238120955&postID=6958257589352009822&from=pencil	account google blogger sign espaol franais united slovenina portugus english  find create privacy help azrbaycan melayu etina kingdom latinoamrica
20	http://www.modeloreceta.es/	receta gratis mdica modelo tlf nombre hacer en direc recetafecha del nif observaciones 3 tweetv2 medicamentoposologaduraci pacientemail datos logo facultativomail
20	http://www.bing.com/	image bingbingimagesvideosmapsnews msnoffice onlineexcel onlineonenote comonedrivecalendarpeopleoutlook inrewardsinfoadded alldont favorite into see devicedownload restricted use only wallpaper todays any keep sign
60	http://www.anuncioneon.com/	en de y anuncios c muy 30 casas gratis sin por muebles venta ofertas cursos n0sotr0s mudanzas economicos contacte maltes
40	http://mx.anuncioneon.com/	en de 000 terreno oportunidad 3 carretera m2 habal con excelente lote anuncios 2 una 1 av zona 4 890
57	http://cursosinemweb.es/como-sellar-el-paro-por-internet/	de la el por que ayudas paro en y para sellar las empleo cita previa se internet demanda tarjeta inem
36	https://www3.gobiernodecanarias.org/empleo/portal/web/sce/contenido_web_estatico/el_sce_oficina_virtual_servicios_inscripcion_renovacion_demanda_empleo	de servicios persona nombre su mail e destinataria  servicio contacto web buscar noticias prensa anuncios han datos componente sociales
36	https://www.asturias.es/portal/site/trabajastur/menuitem.064aab7b0c7b3b45d0e40910331081ca/?vgnextoid=4e1e9f18540e7310VgnVCM10000098030a0aRCRD&i18n.http.lang=es	de empleo la demanda en y tu mi ofertas por como para internet trabajastur del acceso el profesionales asturias app
40	https://sede.sepe.gob.es/portalSedeEstaticos/flows/gestorContenidos?page=cb00	de y demanda la del trmites electrnica sepe en empleo sede saltar servicios informacin tu comunidad 901 pblico servicio autnoma
40	https://empleocastillayleon.jcyl.es/oficinavirtual/index.do	de servicios consulta demanda informe empleo oficina ecyl ofertas la  conexin tcnicos explicativas domingo acceso copia incorporacin solicitud situacin
34	http://www.quetzal.com/conlang.html	available constructed languages fiction other language lojban human ftp ll please web know just site logical learn more  order
54	http://www.quantonics.com/The_Prodigy_Review.html	sidis billy william james boris see pirsig him more amy rev 151 book chapter new quantum harvard review doug page
18	http://www.pobox.com/~keithlim/jabberwocky/	jabberwocky translations parodies keithlim com pobox  lewis 58 languages beyond spoofs themes 10 http keith lim explanations poem various
6	http://www.pinette.net/chris/startrek/ferengi.html	loans payday your post time before credit online cash need very bankruptcy 5 many direct money should card lenders financial
24	http://www.picturelanguage.com/	top best picturelanguage com search high find phones work smart accident credit lawyers internet speed home lyrics 10 song 
6	http://www.phz.web1000.com/ygydeen.html	match singles perfect web1000 seeking com  links related relationship dating personals photo american
12	http://www.phy.duke.edu/~trenk/elvish/index.html	parma tyelpelassiva  hosted fiction please your bookmarks update org science now moved
60	http://www.phon.ucl.ac.uk/home/sampa/home.htm	sampa eng ipa symbols phonetic unicode open alphabet languages been symbol rounded turned readable note ascii fr mid c other
32	http://www.ucl.ac.uk/	ucl news london research university read 2017 new drug language students global access departments disease strategy 20 using more support
17	http://www.elgin.free-online.co.uk/ipa_inst.htm	more instant ipa please  distribute recent ipascript features use online demo try intuitive many product instead see program longer
45	http://www.download.com/Browsers/	free rating your browsers user download software best apps windows downloads security publisher video view web mac editors internet browser
17	http://www.cocosda.org/	page web  cocosda des mais fureteur en pas frames browser them support your uses accomode ne votre cadres utilise
40	http://www.navarra.es/home_es/Temas/Empleo+y+Economia/Empleo/Informacion/Servicio+Navarro+de+Empleo/Default.htm	de empleo el servicio navarro navarra la es contenido cenifer iturrondo formacin en centro y buscador estamos dnde  castellano
38	http://www.morxa.force9.co.uk/xlang.htm	languages xa language xaldashi such n xathmel common ni dialects related ak between culture literature homeworld other system paore q
40	http://www.math.ucla.edu/~jimc/guaspi	gua spi vocabulary index use language introduction dictionary link james suited humans express human grammar orders simpler word meanings through
60	http://www.math.bas.bg/~iad/univers.html	marked universal o al 3 same la j marker gt language vowel sg m suffix laquo thou f raquo optionally
40	http://www.manythings.org/voa/voa.htm	english special people voa simple american helps short science voice america words some used events idioms medicine each world week
54	http://www.lojban.org/	lojban la language com english lo questions 2017 your learning re other dictionary talk e chat languages 12 community using
60	http://www.loglan.org/welcome.html	loglan lognet la available language 3 part first articles randall list institute lodtua story brown english how sau robert download
40	http://www.sparepartscomics.com/comics/index.php?date=20041029	spare comic parts friday marks now drive october 29th news terrence started m bit tire right running 2004 story 2003
20	http://www.chat.ru/%7Eloglan	2000 06 1 loglan zip rtf  language lingvo mi takna la 22 56 17 04 ivanov 2007 rex may
51	http://math.boisestate.edu/~holmes/	here version set theory some page am find math new notes argument language pdf office theorem project very approach nf
38	http://mailman.ucsd.edu/mailman/listinfo/loglanists	list your loglanists password email subscription address enter mailing once ucsd only language subscribers discussion among loglan usa english interested
19	http://linker.com/jcb	jcb trade answers system  learn other english case between complete first presentations pdf powerpoint test description sql comparison business
34	http://jan.ucc.nau.edu/%7Erdr	home page nau reed d courses anthropology riner  continuing contact solar simulation site reconstruction interests professional office taught enhanced
40	http://www.lodz.tpsa.pl/bez/Tolkien/Arda/index.html	jezyk r z e nie ze w tolkien l polska strona przynajmniej j 1997 tolkiena liczba mowa jezyki ardalambion helge
40	http://www.lindienen.de/	und quenya des sind den singing von seite lindinen aussprache vokabeln lektionen banks tolkien page helge ardalambion listen waters sound
40	http://www.langmaker.com/addconlang.htm	benim bir en ve hayat langmarker hakkmda fethi farkl ait doaya neler yaam ile doa vazgeilmez stres zevk iin bu
40	http://www.lanbide.euskadi.eus/inicio-lanbide/	de la y para empleo vasco informacin el en lanbide del 160 servicio al general oferta cursos 07 solicitud lanbidenet
13	http://www.lambion-ardava.de/	frames  index seite von browser nicht untersttzt aber ihrem werden verwendet diese
57	http://www.kaupelan.hpg.ig.com.br/index.htm	de e o em ig com que na veja confira para mais sobre da diz brasil cupom se mundo um
57	https://www.ativo.com/corrida-de-rua/noticias/corredor-ajuda-concorrente-a-completar-prova-nos-eua/	de ativo e por que o corrida para com sua na newsletter esporte guia prova conta rua orach treinamento lo
19	https://emailpremium.ig.com.br/	ig e mail de assine agora  possui conta tire duvidas um aqui 1 assinatura jornal paulo 2000 publicidade ltda
38	https://email.ig.com.br/forgot-password	ig de o digite contedo imagem mail sites e email seu lado ao senha  economia gente vdeos papo facebook
57	http://www.tribunadabahia.com.br/	e de o poltica 08 2017 h horas minutos cidade na que 12 da para esporte em com 11 tribuna
20	http://www.tribunadabahiavirtual.com.br/	tribuna da bahia virtual tem agora login faa intelbit cadastro  na fcil grtis dificuldades ou de br 2017 os
57	http://www.secom.ba.gov.br/2017/07/139903/Governo-investe-R-86-milhoes-para-atender-205-mil-jovens-com-emprego-estagio-e-bolsas-de-estudo-ate-2018.html	de e o governo da para bahia jovens com em estgio r emprego estado milhes 2018 na comunicao secom estadual
38	http://www.transparencia.ba.gov.br/	da de bahia para o pular alt informao despesas pgina transparncia menu 2 secretaria estado fazenda sefaz planserv ligaes fixo
57	http://www.restauranteveleiro.com.br	de e com o ao molho veleiro da os em almoo segunda na arroz restaurante reservas 11h30 estacionamento manobrista 2105
60	http://www.portaldoservidor.ba.gov.br/conteudo/recadastramento-funcional-ativos-2017	de e da recadastramento o ativos servidor para dos 2017 servidores bahia estado n contracheque os funcional na estadual executivo
40	https://rhbahia.ba.gov.br/	de secretaria da sec e bahia o governo desenvolvimento portal administrao servios para acesso ouvidoria estado contedo senha usurio geral
40	http://www.sec.ba.gov.br/siig/WebSelecionarProcessos.asp	ex o processo 2001 atilde siig consulta digitar cula matr por cart  1983 1985 1987 1989 1991 1993 1995
40	http://www.saude.ba.gov.br/novoportal/index.php?option=com_content&view=article&id=8279&Itemid=14	de ouvidoria e da em sade sesab bahia cidado perguntas todos prevenorede secretaria atendimentotransparncia para nsorientao principalserviossade informaes espao um
19	http://www.recadastramento2017.ba.gov.br	verso ou maior senha  login suportado favor um navegadores internet 11 31 2017 utilizada acesso contracheque esqueci dvidas getappversion
0	http://www.prevbahia.com.br/	 prevbahia complementar servidores da bahia pblicos dos previdncia
60	http://www.perfiladministracaopublica.ba.gov.br/	de da bahia ccedil atilde secretaria o e estado ncia aacute superintend desenvolvimento estadual companhia funda uacute instituto baiana oacute
14	http://www.legislabahia.ba.gov.br/	pesquisar  casa legislao aguarde salvar pdf resultado visualizar em login documentos estadual civil
19	http://www.ctc.ba.gov.br/	de tempo certido contribuio estado para previdncia regime que ex  web social ou e levar trabalhado em inss outro
40	http://www.certidaoprevidencia.ba.gov.br/index3.asp	de certido da benefcio previdencirio e pela servio tem registro cpf identificao o apresentando consulta negativa estado secretaria documento emisso
40	http://srhportal.ba.gov.br/srhccservidor/index_msenha.asp	de da secretaria e bahia estado desenvolvimento estadual 8211 empresa recursos fundao superintendncia companhia instituto para agncia universidade servidor centro
40	http://sistemas.pge.ba.gov.br/consultaweb	sec da de e geral bahia estado procuradoria pge governo para ouvidoria servios desenvolvimento 3 pular social brasil o site
19	http://ixpress.bahia.ba.gov.br/ixpress/protocolo/teste/consulta.DML	n duplicata da  senhores caso 1 favor o zero campo nmero digitar via seja usurios portal processo servidor
0	http://dovirtual.ba.gov.br/egba/reader2/	 empresa ica bahia virtualpaper da gr
60	http://www.ouvidoriageral.ba.gov.br	de da e secretaria 8250 geral ouvidoria o mais estado em sec governo para leia bahia ouvidor ao na cidado
0	http://www.tag2.ouvidoriageral.ba.gov.br/	 bem ao tag vindo
57	http://www.sihs.ba.gov.br/	de da secretaria e governo 8250 saneamento infraestrutura o mais hdrica sihs com sec leia bahia abastecimento em estado gua
57	http://www.sdr.ba.gov.br/	de da secretaria o e desenvolvimento para bahia 8250 08 mais rural 2017 governo com agricultura sec leia na que
60	http://www.sde.ba.gov.br/	o de ccedil atilde e ver baixar bahia aacute da sec oportunidades n oacute otilde revista es uacute 2017 estado
36	https://outlook.office365.com/	account your sign address email user browser microsoft someone cookies com use re javascript id look contoso example type allow
38	http://www.sudic.ba.gov.br/	de da secretaria e bahia governo 8250 sec desenvolvimento 08 para 10 2017 leia mais sudic o na estado superintendncia
60	http://www.sei.ba.gov.br/	de e da em bahia o boletins livros tcnicas revistas notas etc tabelas tcnico boletim estado 2017 econmica salvador maio
60	http://www.sebrae.com.br/uf/bahia/	evento ps ctd vcmusr vcmsys int long dt sebrae 1 e de channel inicio despublica fim siac o type final
57	https://meuatendimento.sebrae.com.br/appportal/fale-especialista.do	de sebrae e o com para negcio empresa mais fale como sua negcios que rio gesto um os cursos busca
57	http://www.varejosebrae.blogspot.com.br/	de e o que com para da em os um dos por uma mais como 2016 se das feira loja
40	http://www.sustentabilidade.sebrae.com.br	de sustentabilidade para mais e sua ampliar da sebrae voc empresa ver centro gesto dimenses sustentveis publicaes institucional acontece somos
57	http://www.justicasocial.ba.gov.br//modules/conteudo/conteudo.php?conteudo=28	de e secretaria da o social passe livre direitos com sec desenvolvimento governo quem intermunicipal apresentao humanos para bahia deficincia
60	http://www.juceb.ba.gov.br/modules/conteudo/conteudo.php?conteudo=45	de e o que empresas da registro redesim por alterao governo em constituio bahia para nome brasil sistema juceb inscrio
57	http://www.ibametro.ba.gov.br/	de o e da secretaria 8250 para ibametro governo mais bahia consumo sec com leia que baiano por na metrologia
60	http://www.fieb.org.br/	de e fieb o da senai sistema indstria sobre cursos industrial inovao iel desenvolvimento estgio bahia na em organograma 2017
57	http://www.timemsalvador.com.br/	de e da o em inner game que gallwey para como com tim coaching workshop na mais foi aprendizado nos
40	http://www.tecnicosenai.com.br	de unidade o senai para cursos site que poltica usurio privacidade informaes alagoinhas barreiras feira lauro magalhes salvador ou 71
40	http://www.senaicimatec.com.br/	e de cimatec senai mais inovao saiba tecnologia o para em industrial na software pesquisa os centro desenvolvimento contato 08
40	http://www.ebal.ba.gov.br/novagestao/	da de ebal o bahia e pesquisa para na credicesta nova empresa acesso pesquise informaes os depois clique site alimentos
57	http://www.ead.sebrae.com.br/	de sebrae e o empresa sua negcio com como fale mais item da rio nome para se cadastre um sul
60	http://www.desenbahia.ba.gov.br/	de da desenbahia nova santa e serra santo conceio financiamento novo central rio barra sua acervo seu na notcias para
19	https://ssl.desenbahia.ba.gov.br/SSF/index.aspx	de solicita ccedil atilde com em financiamento o  clientes desenbahia 0800 16 ou fale conosco pelo 26 285 atrav
57	http://www.finep.gov.br/	de para e 2017 finep seu navegador empresas suporta script recursos limitados alguns java estaro disponvel alterao data o da
40	http://www.datasebrae.com.br/	e de o que da datasebrae pequenos negcios os empresas brasil em como ou dos receita se anual 00 000
40	http://www.cis.ba.gov.br/	de secretaria da governo 8250 bahia sec e o industrial 2017 cis para desenvolvimento em mais leia 06 centro trabalho
40	http://www.cgb.ba.gov.br/	de secretaria da e bahia sec governo 8250 centro mais bsica joalheria desenvolvimento para gemolgico o abertas leia matrculas site
57	http://www.cbpm.com.br/	de da e bahia secretaria na 8250 mineral cbpm o governo para mais sec leia com 00 pesquisa notcias desenvolvimento
51	http://www.bndes.gov.br/	de e bndes o da contedo ao menu em title loading para visualizador aes z7 com os mais componente web
40	http://www.agendadeestagio.com.br	inscrio programao sobre frum de estgio o sua contato e se faa para  aqui mais da fale gente seu
57	http://www.agenciasebrae.com.br/sites/asn	de sebrae 17 08 o notcias para negcios dia na e debate se brasil pequenos estado 00 11 15 10
60	http://sesi.fieb.org.br/sesi/	para sesi indstria o educao veja mais de trabalhador e vida cultura saudvel teatro sst social rio vermelho 00h sade
40	http://sis.fieb.org.br/sesi/transparencia/	de e o sesi transparncia dados da sua oramentrias diretrizes lei contratos licitaes entidade gesto j mesmo os oramentria na
0	http://senaiweb.fieb.org.br/Portal/cursos	 portal loading senai
40	http://pt.scribd.com/imprensa_sei	d v n e da sei de 1 4 2 bahia rmulo publicaes 24 25 almeida estudos planejamento 22 p
40	http://memorial.sebrae.com.br	sebrae depoimentos memorial o notcias virtual cliente e  histria casa livro jesus filho superintendente edival ba peres pe carlos
54	http://lojavirtual.ba.sebrae.com.br/loja/	de 00 com o este 08 inscrio participao e 17 ba sebrae empresa para horrio evento seu sua caso local
38	http://geocatalogo.sei.ba.gov.br/	de da e catlogo ajuda 2017 informaes imagens sei cartografia o bahia geo notcias rea voc para conosco com download
40	http://compras.fieb.org.br	sistema o em ver portal de compras navegador seu ltimos e mural para est explorerfirefoxchromesafari andamento objeto negociaes todas legenda
57	http://cdl.com.br/	de cdl salvador da e o veja mais por bahia liquida com para 2017 lojista parceria ac fonte comunicao diretoria
40	http://bis.sebrae.com.br/bis/	sebrae o agoradownloaddocumento interativa sua da digitalcartilha de para  contribuioprocessing avanadapublicaes todas documentosdocumento sade bem tema conhecer mulher nacional
57	http://azimute.sei.ba.gov.br/	de pesquisa da o azimute e sobre para sade em bahia 2013 09 estado na secretaria escolas populao notcias links
32	https://webmail.finep.gov.br/	client web zimbra advanced mobile telligent your standard sign version recommended connections set collaboration browsers internet default inc trademarks systems
40	https://servicos.spc.org.br/spc/controleacesso/autenticacao/entry.action	o para senha atilde spc brasil ccedil sua n mais os acessar  agora firefox explorer sistema aacute solicitar e
57	http://www.tigis.com.br/essentials	de e em tigis inner game gesto o como na com das para que da facilitador 2017 se coach pela
57	http://www.spc.com.br	de cdl salvador da e o veja mais por bahia liquida com para 2017 lojista parceria ac fonte comunicao diretoria
40	http://www.sinergiamt.com.br	e de o sinergia mt coaching um para em cursos da que terapias 65 desenvolvimento voc bem tel claudio brasil
40	http://www.portaldoempreendedor.gov.br/mei-microempreendedor-individual/formalize-se	o formalizao inscrio para busca de pular  mapa aumentar diminuir assim autocontraste javascript nesta avanada est pgina mei individual
